id,title,score,num_comments,created_utc,author,url,is_ask_hn
48892709,Nokia’s years of mobile-phone supremacy ended in an afternoon,185,165,1783950850,jruohonen,https://spectrum.ieee.org/nokia-phones-history,False
48900686,Turn your singing voice into printable notes (in the browser),93,26,1783987836,busssard,https://om-intelligence.ch/projects/vocal-notation/vocal-notation.html,False
48918534,Telegram Serverless,212,106,1784109999,soheilpro,https://core.telegram.org/bots/serverless,False
48935487,We're Building Postgres in Rust. Using the LLVM of Databases,107,26,1784213827,polyrand,https://turso.tech/blog/a-new-modern-version-of-postgres-in-rust,False
48919869,Briar is in maintenance mode,171,107,1784118807,ristello,https://briarproject.org/news/2026-maintenance-mode/,False
48943745,EEG shows brain can simultaneous encode two speech streams,256,179,1784267470,giuliomagnifico,https://journals.plos.org/plosbiology/article?id=10.1371/journal.pbio.3003876,False
48973782,Big tech is now targeting Native American land for data centers,61,13,1784514858,reaperducer,https://www.nytimes.com/2026/07/09/us/data-centers-native-american-tribes.html,False
48970814,I argued with the father of open source for 2 years Now the AI fight is the same,14,1,1784487751,t-3,https://fortune.com/2026/07/03/open-source-ai-same-fight-as-software-fight-1980s-david-siegel-two-sigma/,False
48951500,A24 Is Copyright Striking Backrooms Artwork Older Than the Movie,25,1,1784317437,josephcsible,https://www.thegamer.com/the-backrooms-a24-copyright-strike-artwork/,False
48927095,"Governments, companies, nonprofits should invest in free, open source AI [pdf]",296,113,1784150196,bilsbie,https://www.siegelendowment.org/wp-content/uploads/2026/07/fortune-david-siegel-open-source-ai.pdf,False
48862165,An Engineer's Guide to USB Typе-С (2024),298,81,1783701086,gregsadetsky,https://www.ti.com/lit/eb/slyy228/slyy228.pdf?ts=1759892558029,False
48974043,Apple Is the King of AI and Nobody Knows It,5,3,1784518099,jinjin2,https://limitededitionjonathan.substack.com/p/apple-is-the-king-of-ai-and-nobody,False
48940603,Ring-Zero: Scaling Zero RL to a Trillion Parameters for Emergent Reasoning,61,27,1784237882,binyu,https://arxiv.org/abs/2607.12395,False
48936389,Show HN: Leaves – A text-UI disk usage treemap visualizer,90,31,1784217823,patonw,https://github.com/patonw/leaves,False
48886040,Circular Obstacle Pathfinding (2017),33,2,1783899761,andsoitis,https://redblobgames.github.io/circular-obstacle-pathfinding/,False
48926939,Show HN: Firefox in WebAssembly,271,126,1784149217,coolelectronics,https://developer.puter.com/labs/firefox-wasm/,False
48921303,"My midlife crisis Corolla is fast, furious, and modded",199,426,1784125424,gmays,https://www.zocalopublicsquare.org/my-midlife-crisis-corolla-fast-furious-fully-modded/,False
48965585,UK to Scrap Digital ID,35,14,1784444085,i-am-cjc,https://www.bbc.co.uk/news/articles/c5y08z25q8eo,False
48900287,Estimating the heights of New Yorkers from their scuff marks,41,12,1783984937,eat_veggies,https://blog.jse.li/posts/smith9street/,False
48935510,Guide to data tools landscape for developers,132,36,1784213954,OlegWock,https://sinja.io/blog/data-landscape-guide-for-developers,False
48978285,Chinese AI model Kimi K3 halts new signups amid skyrocketing demand,3,1,1784552430,teleforce,https://www.euronews.com/next/2026/07/20/chinese-ai-model-kimi-k3-halts-new-signups-amid-skyrocketing-demand,False
48968295,Show HN: PostgreSQL course with database running in your browser,6,4,1784469532,Serpant,https://learnpg.xyz,False
48932722,Abstracting Effects with Continuations,73,6,1784198499,crowdhailer,https://crowdhailer.me/2026-07-15/abstracting-effects-with-continuations/,False
48877137,Old Icons,99,30,1783815864,zdw,https://leancrew.com/all-this/2026/07/old-icons/,False
48950518,Lego building instructions through time,155,42,1784312474,NaOH,https://www.lego.com/en-us/history/articles/d-lego-building-instructions-through-time,False
48946688,Alzheimer's trial results lend momentum to strategies targeting tau,30,9,1784292130,lonelyasacloud,https://www.science.org/content/article/alzheimer-s-trial-results-lend-momentum-strategies-targeting-tau,False
48906893,The Conservationist Who Turned 40 Terabytes of Public Data into a Video Game,122,21,1784037141,bryanmikaelian,https://blog.exe.dev/meet-the-conservationist-who-turned-40-terabytes-of-government-data-into-a-video-game,False
48956491,GitRoot,21,5,1784366862,ilreb,https://gitroot.dev/,False
48926053,Voxatron,109,27,1784144423,lsferreira42,https://www.lexaloffle.com/voxatron.php,False
48897104,The infinite scroll may become endangered if controversial Calif. law passes,227,438,1783968833,Stratoscope,https://www.sfgate.com/politics/article/meta-social-media-teenagers-22337724.php,False
48958814,British runner Josh Kerr breaks world record for mile which stood for 27 years,129,66,1784387312,austinallegro,https://news.sky.com/story/british-runner-josh-kerr-breaks-world-record-for-mile-which-had-stood-for-27-years-13564688,False
48901356,Satellite Tracker – Live Map of Starlink and 30k Satellites,165,100,1783994124,rolph,https://satellitemap.space/,False
48973821,The 2000s called. They want their digital camera back,10,5,1784515245,megamike,https://www.npr.org/2026/07/18/nx-s1-5896117/retro-digital-camera-analog-reboot,False
48922838,Show HN: misa77 - a codec that decodes 2x faster than LZ4 (at better ratios),164,49,1784131139,nonadhocproblem,https://github.com/welcome-to-the-sunny-side/misa77,False
48936880,Detecting LLM-Generated Texts with “Classical” Machine Learning,246,175,1784220097,uneven9434,https://blog.lyc8503.net/en/post/llm-classifier/,False
48973772,See inside insects with an electron microscope and a femtosecond laser [video],5,0,1784514749,pillars,https://www.youtube.com/watch?v=NwhVJ7cv9B4,False
48964383,Association Between Low/No-Calorie Artificial Sweeteners and Cognitive Decline,6,3,1784426837,corvad,https://www.neurology.org/doi/10.1212/WNL.0000000000214023,False
48964364,"Implementation of ""Writing a C compiler"" in Zig",6,0,1784426580,rguiscard,https://github.com/igor84/wcc,False
48871721,"G# – A modern .NET language with Go, Kotlin, and Swift ergonomics",118,104,1783775086,serial_dev,https://davidobando.github.io/gsharp/,False
48939641,The privacy problems hidden in your period tracker,109,66,1784232958,tchalla,https://www.bbc.com/future/article/20260715-how-period-trackers-share-womens-private-details,False
48947825,The state of open source AI,484,356,1784298670,rellem,https://stateofopensource.ai/,False
48972054,The Control Group Is Out of Control (2014),11,0,1784498500,downbad_,https://slatestarcodex.com/2014/04/28/the-control-group-is-out-of-control/,False
48903777,"European ""age verification"" ""app"" forcing everyone to use Android or iOS",584,431,1784018097,roundabout-host,https://github.com/eu-digital-identity-wallet/av-doc-technical-specification/discussions/19,False
48967650,The Beauty of a Stone Wall,4,1,1784464608,NordStreamYacht,https://www.theatlantic.com/ideas/2026/07/second-career-passion-life-meaning/687952/,False
48948597,Frame – Linux X server in Assembly,156,107,1784302282,guybedo,https://isene.org/2026/07/Frame.html,False
48884068,A Beautiful Theory Falls to Ugly Data,81,69,1783885936,paulpauper,https://marginalrevolution.com/marginalrevolution/2026/05/a-beautiful-theory-falls-to-ugly-data.html,False
48908950,Launch HN: Agnost AI (YC S26) – Extract user feedback from agent conversations,85,52,1784045178,laalshaitaan,https://agnost.ai,False
48927915,LLM Networking with MikroTik,105,60,1784154207,gregsadetsky,https://blog.greg.technology/2026/07/14/llm-networking-with-mikrotik.html,False
48929945,"1,300 Beautiful Wildlife Illustrations from the 19th Century Now Restored",257,50,1784171567,gslin,https://www.openculture.com/2026/07/explore-1300-beautiful-wildlife-illustrations-from-the-19th-century.html,False
48979051,"China bans AI ""boyfriends"" and ""girlfriends"" over addiction, birth rate concerns",6,1,1784556284,randycupertino,https://www.dexerto.com/entertainment/china-bans-ai-boyfriends-and-girlfriends-over-addiction-and-birth-rate-concerns-3388737/,False
48967220,Show HN: Textcaster – social networking where RSS is the protocol,11,2,1784461403,rmdes,https://textcaster.app,False
48954175,"Moonstone: Modern, cross-platform Lua runtime and package manager written in Zig",66,23,1784337495,ksymph,https://moonstone.sh/,False
48879529,In Praise of Exhaustive Destructuring,50,7,1783846695,avandecreme,https://antoine.vandecreme.net/blog/exhaustive-destructuring-praise/,False
48950774,Show HN: A zoomable timeline of 4M Wikipedia events,116,43,1784313453,lortex,https://app.everything.diena.co/,False
48905248,How to stop Claude from saying load-bearing,608,611,1784029562,shintoist,https://jola.dev/posts/how-to-stop-claude-from-saying-load-bearing,False
48941104,The Little Book of Reinforcement Learning,210,26,1784240842,mustaphah,https://github.com/alxndrTL/little-book-rl/,False
48954326,Recreating the Bell Labs Cafeteria,15,1,1784339269,walterbell,https://danielmiessler.com/blog/recreating-the-bell-labs-cafeteria,False
48905118,Punch yourself in the face with reality,245,126,1784028799,AdityaAnand1,https://adi.bio/reality,False
48965081,AXI – Agent EXperience Interface,5,3,1784436656,jeffscottward,https://axi.md/,False
48955279,Three workers digging in a field outside the data center,15,6,1784349539,jruohonen,https://sign2.nl/websign/three-workers-digging-in-a-field-outside-the-data-center-by-dinnis-van-dijken/,False
48907263,Tannakian Reconstruction,34,3,1784038551,ibobev,https://bartoszmilewski.com/2026/07/14/tannakian-reconstruction/,False
48963483,Harness Engineering,78,33,1784417256,handfuloflight,https://github.com/lopopolo/harness-engineering,False
48922434,Running Gemma 4 26B at 5 tokens/sec on a 13-year-old Xeon with no GPU,328,212,1784129645,neomindryan,https://www.neomindlabs.com/2026/06/08/running-gemma-4-26b-at-5-tokens-sec-on-a-13-year-old-xeon-with-no-gpu/,False
48892859,"Show HN: Clawk – Give coding agents a disposable Linux VM, not your laptop",225,158,1783951323,celrenheit,https://github.com/clawkwork/clawk,False
48903082,Indian scientists produce most detailed 3D atlas of the human brainstem,219,22,1784011408,BaudouinVH,https://www.bbc.com/news/articles/cg53l737v1qo,False
48908178,Are we offloading too much of our thinking to AI?,523,477,1784042293,yenniejun111,https://www.artfish.ai/p/offloading-thinking-to-ai,False
48941123,Show HN: Mojibake – A low-level Unicode library written in C,77,22,1784240961,program,https://mojibake.zaerl.com/,False
48947455,A Road to Lisp: Which Lisp,200,166,1784296564,silcoon,https://scotto.me/blog/2026-07-17-which-lisp/,False
48963108,Even Microsoft couldn't make Windows 11 work well on 8GB of RAM,47,28,1784413892,GeekyBear,https://www.theverge.com/tech/966937/microsoft-surface-laptop-13-inch-8gb-ram-2026-review,False
48968149,What Did We Lose When We Lost the Stars,15,3,1784468536,longdefeat,https://theconvivialsociety.substack.com/p/what-did-we-lose-when-we-lost-the-c3b,False
48964851,Things that made me come back to Emacs,5,0,1784433552,signa11,https://cephei8.dev/blog/emacs-things/,False
48964819,"RL economics, morally charged terms, and ""distillation""",5,0,1784432907,samuel246,https://thomasdullien.github.io/posts/2026-06-15-rl-economics-morally-charged-terms-and-distillation/,False
48888518,Backtrack-Free Cursive,277,126,1783922892,dmit,https://mmapped.blog/posts/52-backtrack-free-cursive,False
48953519,Claude Code(Fable) refused my slow down instruction,32,13,1784331596,qusaisuwan,https://qusaisuwan.github.io/cc-incident/index.html,False
48917755,"Porting nanochat to a TPU: what carries over from PyTorch, and what breaks",53,11,1784103505,tucan9389,https://github.com/tucan9389/nanochat-jax/discussions/1,False
48957889,The Voice of Google,15,1,1784380557,cjcenizal,https://www.newyorker.com/culture/the-weekend-essay/the-voice-of-google,False
48953406,The Isomorphic Labs Drug Design Engine unlocks a new frontier beyond AlphaFold,81,8,1784330795,andsoitis,https://www.isomorphiclabs.com/articles/the-isomorphic-labs-drug-design-engine-unlocks-a-new-frontier,False
48959302,No link between acetaminophen use during pregnancy and adverse birth outcomes,77,56,1784390589,geox,https://sph.unc.edu/sph-news/no-link-between-acetaminophen-use-during-pregnancy-and-adverse-birth-outcomes-study-finds/,False
48979329,Majority of US voters link extreme weather to climate crisis,10,1,1784557561,speckx,https://www.theguardian.com/environment/2026/jul/19/climate-crisis-us-voters-study,False
48893446,Precursor,207,160,1783953578,AznHisoka,https://blog.cloudflare.com/introducing-precursor/,False
48870816,Engineering Peace,19,5,1783767122,jkly,https://asteriskmag.com/issues/14/engineering-peace,False
48909785,The Tower Keeps Rising,554,270,1784048274,cdrnsf,https://lucumr.pocoo.org/2026/7/13/the-tower-keeps-rising/,False
48928135,SQLite should have (Rust-style) editions,363,172,1784155378,gnyeki,https://mort.coffee/home/sqlite-editions/,False
48903715,Alternative(s) to run CUDA on non-Nvidia hardware,142,75,1784017489,alok-g,https://www.hpcwire.com/2026/07/09/spectral-compute-aims-to-set-cuda-free-will-it-succeed/,False
48912013,The Memory Heist,98,15,1784058054,eieio,https://www.ayush.digital/blog/the-memory-heist,False
48919198,"Prioritize mental health, and why communication is so important",338,284,1784114855,ramon156,https://ramones.dev/posts/mental-health/,False
48974077,Tyler Cowen: The Future Belongs to AI Maniacs,3,0,1784518591,ripe,https://www.thefp.com/p/tyler-cowen-ai-maniacs-future-economy,False
48915393,High-Bandwidth Flash offers efficient storage for model weights,72,25,1784081052,Gaishan,https://spectrum.ieee.org/high-bandwidth-flash,False
48928313,"Metal-Organic Frameworks, Chemistry's New Miracle Materials (2018)",69,16,1784156431,andsoitis,https://chemistry.berkeley.edu/news/meet-metal-organic-frameworks-chemistry%E2%80%99s-new-miracle-materials,False
48964458,Gaming Sickness and Its Impact on Players' Experiences with Games,5,0,1784427754,BiraIgnacio,https://dl.acm.org/doi/10.1145/3670653.3677494,False
48972975,"Forget the model. When it comes to cybersecurity, it's all about the harness",7,0,1784506668,Gaishan,https://cyberscoop.com/ai-cybersecurity-harness-autonomous-hacking/,False
48901454,Fundamentals of Wireless Communication (2005),182,13,1783995019,teleforce,https://web.stanford.edu/~dntse/wireless_book.html,False
48901645,Our Amish Language,105,98,1783996841,NaOH,https://www.thedial.world/articles/news/amish-pennsylvania-dutch,False
48971827,Three HPC Gurus Ask: Do We Still Need GPUs?,8,1,1784496589,rbanffy,https://www.nextplatform.com/compute/2026/06/30/three-hpc-gurus-ask-do-we-still-need-gpus/5264552,False
48913763,LeMario: Training a JEPA World Model on Super Mario Bros,136,15,1784068247,kevinjosethomas,https://www.benjamin-bai.com/projects/lemario,False
48940231,Scaling to 1M concurrent sandboxes in seconds,75,15,1784235872,thundergolfer,https://modal.com/blog/scaling-to-1-million-concurrent-sandboxes-in-seconds,False
48953349,Show HN: Qwen3.6-35B-A3B on a 16 GB M1 Pro with SSD-streamed MoE,22,4,1784330414,andreaborio,https://github.com/andreaborio/ds4,False
48936534,Agent-talk: Enabling coding agents to work together,55,24,1784218460,xhluca,https://github.com/xhluca/agent-talk,False
48966012,Refs: Mutable Arrays in jax,3,0,1784449510,cl3misch,https://docs.jax.dev/en/latest/array_refs.html,False
48964141,Ergonomic keyboard generator with hand scanning,5,0,1784424038,ffin,https://ryanis.cool/cosmos/,False
48919013,Weathergotchi – an E-Paper Climate Logger,121,28,1784113363,luanmuniz,https://github.com/Michael-Manning/E-Paper-Climate-Logger,False
48940895,CVE-2026-25089: FortiSandbox unauthenticated command injection added to CISA KEV,33,1,1784239650,slvnx,https://hellorecon.com/blog/cve-2026-25089,False
48969656,HuggingFace security incident: Guardrails vs. Open Models,13,3,1784479630,benjiro29,https://huggingface.co/blog/security-incident-july-2026,False
48965874,Wolfram LLM Benchmarking Project,3,0,1784447920,rzk,https://www.wolfram.com/llm-benchmarking-project/,False
48963614,Anthropic's newest ad is creeping people out,43,8,1784418618,gnabgib,https://techcrunch.com/2026/07/14/anthropics-newest-ad-is-creeping-people-out/,False
48926085,"Brainless: Shadcn components that look like Claude Code, Codex and Grok",128,26,1784144573,benswerd,https://brainless.swerdlow.dev,False
48961120,Show HN: Peek-CLI: Let Claude Code iterate on front end designs,6,1,1784401370,G3819,https://github.com/puffinsoft/peek-cli,False
48856746,Let's build a simple interpreter for APL – part 1,43,3,1783667818,mpweiher,https://mathspp.com/blog/lsbasi-apl-part1,False
48898134,"Linux 0.11 rewritten in idiomatic Rust, boots in QEMU",137,141,1783973489,arto,https://github.com/Poseidon-fan/linux-0.11-rs,False
48939764,Timeline Scan – AI fixes the dates on your scanned photos,35,33,1784233547,HoserHoser,https://timelinescan.com/,False
48963825,One token is enough: fingerprinting LLMs from one token output distributions,6,0,1784420767,anigbrowl,https://arxiv.org/abs/2607.10252,False
48962922,curl can be used to send emails with SMTP,43,5,1784412337,21sys,https://mastodon.social/@chr1stian/116924759058231144,False
48892273,"MITS: Rockets, Calculators, and Personal Computers",53,8,1783948834,BirAdam,https://www.abortretry.fail/p/micro-instrumentation-and-telemetry,False
48904095,Demis Hassabis has a plan to harness AI safely,158,201,1784020807,asiergoni,https://twitter.com/demishassabis/status/2076957440109625718,False
48910676,Cursor 0day: When Full Disclosure Becomes the Only Protection Left,453,202,1784051915,Synthetic7346,https://mindgard.ai/blog/cursor-0day-when-full-disclosure-becomes-the-only-protection-left,False
48951960,"Aurora DSQL: Scalable, Multi-Region OLTP",21,2,1784320272,shenli3514,https://arxiv.org/abs/2607.13276,False
48944333,Pushinka,50,15,1784273395,benbreen,https://en.wikipedia.org/wiki/Pushinka,False
48921461,OpenAI loses trademark dispute at EU court,263,167,1784125956,hermanzegerman,https://dpa-international.com/economics/urn:newsml:dpa.com:20090101:260715-930-389143/,False
48905183,Mathematical texts from a Maya site in Guatemala identify an ancient astronomer,118,29,1784029234,homarp,https://www.nature.com/articles/d41586-026-02170-8,False
48913457,Probably check on your smart appliances,100,44,1784066441,xena,https://xeiaso.net/notes/2026/check-your-smart-tv/,False
48920432,The Three-Second Theft: Why AI Voice Fraud Outruns Every Defence,190,245,1784121495,dxs,https://smarterarticles.co.uk/the-three-second-theft-why-ai-voice-fraud-outruns-every-defence,False
48965552,Show HN: FlexInference LLM Router,3,0,1784443493,Aperswal,https://www.flexinference.com,False
48973706,The Better Network That Lost: Why Token Ring Died,3,0,1784513917,cable2600,https://www.youtube.com/watch?v=8TRelDpcLHs,False
48894752,"Apple's new SpeechAnalyzer API, benchmarked against Whisper and its predecessor",569,238,1783958768,get-inscribe,https://get-inscribe.com/blog/apple-speech-api-benchmark.html,False
48963373,Godecompose: Go decompiler that uses pattern matchers,5,1,1784416221,cookiengineer,https://github.com/cookiengineer/godecompose,False
48965459,Controlling Reasoning Effort in LLMs,4,0,1784442073,vismit2000,https://magazine.sebastianraschka.com/p/controlling-reasoning-effort-in-llms,False
48876441,Stop Telling Me to Ask an LLM,244,139,1783808928,theorchid,https://blog.yaelwrites.com/stop-telling-me-to-ask-an-llm/,False
48969975,OpenAI is breaking Silicon Valley unwritten code. That's why Apple is so angry,12,4,1784481837,RestlessMind,https://www.businessinsider.com/openai-breaking-silicon-valley-unspoken-rule-apple-talent-2026-7,False
48908691,Show HN: Simulator for a custom 8-bit discreet logic computer,27,5,1784044219,mehrant,https://msap2.mehran.dk,False
48949240,Homomorphically encrypted CIFAR-10 inference in 200ms,90,42,1784305792,j2kun,https://sofar.belfortlabs.cloud/,False
48896665,Building and shipping Mac and iOS apps without opening Xcode,552,232,1783966936,speckx,https://scottwillsey.com/building-and-shipping-mac-and-ios-apps-without-ever-opening-xcode/,False
48874518,What Every Python Developer Should Know About the CPython ABI,73,5,1783795174,matt_d,https://labs.quansight.org/blog/python-abi-abi3t,False
48973595,The Invisible Geek,11,1,1784512706,mooreds,https://matt-schellhas.medium.com/the-invisible-geek-bb170d6166bc,False
48908271,Show HN: Opening lines of famous literary works,179,104,1784042689,plicerin,https://www.verbaprima.com/,False
48914644,Vancouver PD website features Quick Escape button that wipes itself from history,369,135,1784074553,LookAtThatBacon,https://vpd.ca/,False
48896600,Linux on the Sega 32X. Who needs hardware synchronization primitives anyway?,147,32,1783966705,cakehonolulu,https://cakehonolulu.github.io/linux-on-32x/,False
48902026,YouTrackDB is a general-use object-oriented graph database,174,69,1784000395,gjvc,https://github.com/JetBrains/youtrackdb,False
48879504,Ghostel.el: Terminal emulator powered by libghostty,306,67,1783846379,signa11,https://dakra.github.io/ghostel/,False
48872833,How to build a circular LCD clock,144,66,1783783434,birdculture,https://blinry.org/lcd-clock/,False
48908214,I'm a USB-C Maximalist,345,446,1784042436,speckx,https://shkspr.mobi/blog/2026/07/im-a-usb-c-maximalist/,False
48966712,"France, Germany vow to develop Palantir rival",16,7,1784457289,01-_-,https://www.politico.eu/article/france-germany-want-to-develop-a-palantir-rival/,False
48899473,The Estranged Worlds of J. G. Ballard,78,16,1783979876,Caiero,https://lareviewofbooks.org/article/jg-ballard-illuminated-man-christopher-priest-nina-allan/,False
48958273,LG ThinQ Terms of Use,64,30,1784383495,tedggh,,False
48900796,What did SFFA vs. Harvard reveal about admissions?,71,171,1783988803,StrageMusik,https://sorting-machine.pages.dev/,False
48951474,How to Write Unmaintainable Code (2015),31,2,1784317331,theanonymousone,https://github.com/droogans/unmaintainable-code,False
48923111,"Open-source memory for coding agents, synced over SSH",131,35,1784132103,vshulcz,https://github.com/vshulcz/deja-vu/,False
48907290,Agnes Callard’s theory of the uni-context,98,102,1784038659,FinnLobsien,https://www.derekthompson.org/p/a-philosophers-one-word-theory-to,False
48918270,Using Go for Mobile Apps,55,25,1784107705,theHocineSaad,https://www.davidsobsessions.com/p/one-year-of-gomobile/,False
48971910,Is AI Progress Real? Four Independent Metrics Show It,6,6,1784497149,rbuccigrossi,https://skepticcto.substack.com/p/is-ai-progress-real-a-skepticcto,False
48965012,"Google's Gemini delay: Coding stumbles, clashing teams and frustrated engineers",23,6,1784435708,1vuio0pswjnm7,https://www.latimes.com/business/story/2026-07-17/inside-googles-gemini-delay-coding-stumbles-clashing-teams-frustrated-engineers,False
48901224,The Economics of Recursive Self-Improvement [pdf],149,97,1783992923,apsec112,https://elasticity.institute/rsi-paper.pdf,False
48973541,LLMs aren't remotely like compilers or power tools,37,43,1784512079,blainehansen,https://blainehansen.me/post/llms-not-power-tools/,False
48942000,The human-in-the-loop is tired,314,200,1784247669,haritha1313,https://pydantic.dev/articles/the-human-in-the-loop-is-tired,False
48898215,Accidental Anonymity,52,16,1783973866,caminanteblanco,https://macwright.com/2026/06/24/accidental-anonymity,False
48876809,How the FSF sysadmins block botnets with reaction,167,78,1783812372,pseudolus,https://www.fsf.org/blogs/community/blocking-botnets-with-reaction,False
48922487,When A.I. is a member of the family,85,123,1784129867,fortran77,https://www.newyorker.com/magazine/2026/07/20/when-ai-is-a-member-of-the-family,False
48891267,"Show HN: DOM-docx – HTML to native, editable Word docs (MIT)",158,40,1783943516,fishbone,https://github.com/floodtide/dom-docx,False
48964755,Show HN: Synapse – local codebase indexer and MCP server for Claude Code,4,0,1784432120,nrkoka1,https://github.com/nrkoka786/synapse,False
48907672,The Agentic Loop: Three loops in a trench coat,88,32,1784039996,btables,https://www.bobbytables.io/p/the-agentic-loop-three-loops-in-a,False
48871001,World-War-Ⅱ-era telephone line still in use in Upper Tanana Valley Alaska (2021),37,7,1783768785,Lammy,https://www.sketchesofalaska.com/2021/03/world-war-ii-era-telephone-line-still.html,False
48955159,Mac gaming is finally getting the overpowered upgrade it deserves,67,88,1784347980,kristianp,https://www.macworld.com/article/3189951/apples-latest-game-porting-toolkit-beta-changed-how-i-think-about-mac-gaming.html,False
48901235,Is x86 ready to ACE it?,107,31,1783992973,mfiguiere,https://chipsandcheese.com/p/is-x86-ready-to-ace-it,False
48928402,Show HN: One More Letter,90,59,1784157010,hmate9,https://playonemoreletter.com/,False
48852159,Ancient Roman Board Game,140,58,1783630065,nobody9999,https://ludus-coriovalli.web.app/,False
48892638,Benchmarking 15 “E-Waste” GPUs with Modern Workloads,141,64,1783950522,eso_logic,https://esologic.com/benchmarking-tesla-gpus/,False
48853146,World-First 'Super Alloy' Could Transform the Way Metals Are Made,101,59,1783635635,tejohnso,https://www.sciencealert.com/world-first-super-alloy-could-transform-the-way-metals-are-made,False
48878266,Cottage Computer Programming (1984),42,10,1783830583,lioeters,https://www.atariarchives.org/deli/cottage_computer_programming.php,False
48961169,Free AI Harness Profiler – What tf did Fable do with your tokens,4,0,1784401649,TreDub,http://profiler.getrekon.com/,False
48928002,"Agentty – A drop-in alternative to claude-code, written in C++26. 11.0 MB binary",48,13,1784154624,tfeayush,https://github.com/1ay1/agentty,False
