id,title,score,num_comments,created_utc,author,url,is_ask_hn
48979269,China's open-weights AI strategy is winning,228,195,1784557307,benwerd,https://werd.io/american-ai-is-locked-down-and-proprietary-its-losing/,False
48978605,Hacker wipes Romania's land registry database,342,194,1784554113,speckx,https://news.risky.biz/risky-bulletin-hacker-wipes-romanias-entire-land-registry-database/,False
48979931,Corners Don't Look Like That: Regarding Screenspace Ambient Occlusion (2012),98,32,1784560051,firephox,https://nothings.org/gamedev/ssao/,False
48981206,Over 30% of new ArXiv submissions now read as AI-written,28,14,1784565396,dopamine_daddy,https://unslop.run/blog/measuring-ai-writing-on-arxiv,False
48980700,Czechia moves to ban mobile phones in schools from September 2027,22,8,1784563234,Markoff,https://www.expats.cz/czech-news/article/czech-news-in-brief-for-july-20-2026-monday-top-afternoon-headlines,False
48976846,Airport Simulator,401,98,1784543440,apunen,https://airport.apunen.com/,False
48978350,We're Squandering LEDs' Potential to Save Our Night Skies,129,83,1784552831,defrost,https://spectrum.ieee.org/led-light-pollution,False
48978835,Firefox Merges Support for Vulkan Video Decoding,107,23,1784555233,DemiGuru,https://github.com/search,False
48979120,Perfection Is Not Over-Engineering,86,49,1784556630,var0xyz,https://var0.xyz/posts/perfection-is-not-over-engineering.html,False
48980053,The Voice of Google,35,12,1784560536,littlexsparkee,https://www.newyorker.com/culture/the-weekend-essay/the-voice-of-google,False
48975665,Exploit brokers pay $500k for WordPress RCEs. I found one with GPT5.6 and $25,326,171,1784535216,infosecau,https://slcyber.io/research-center/exploit-brokers-pay-500000-for-a-wordpress-rce-i-found-one-with-gpt5-6/,False
48981136,Launch HN: Bloomy (YC S26) – AI-powered mastery learning for K-12,4,21,1784565130,alexsouthmayd,,False
48978792,Shinjuku Station in 3D,45,11,1784554990,Gecko4072,https://satoshi7190.github.io/Shinjuku-indoor-threejs-demo/,False
48980520,"I Stopped ""Creating Content""",13,7,1784562448,mtlynch,https://refactoringenglish.com/blog/why-i-stopped-creating-content/,False
48980019,"Kimi K3, Qwen 3.8, and Anthropic's (Potential) Unravelling",117,120,1784560422,cl42,https://www.emergingtrajectories.com/lh/frontier-lab-economics/,False
48977711,The EU is about to sell our most sensitive data to the US for visa-free travel,348,196,1784549648,rapnie,https://edri.org/our-work/the-eu-is-about-to-sell-our-most-sensitive-data-to-the-us-for-visa-free-travel/,False
48979823,NYC Subway Signals: A Complete Guide,19,6,1784559631,at1as,https://www.nycsubway.org/wiki/Subway_Signals%3A_A_Complete_Guide,False
48973455,Satan's 19th-Century Bank Note (2017),32,1,1784511072,Caiero,https://www.historytoday.com/miscellanies/satans-19th-century-bank-note,False
48979475,Controlling Reasoning Effort in LLMs,13,0,1784558119,ibobev,https://magazine.sebastianraschka.com/p/controlling-reasoning-effort-in-llms,False
48978388,Inertia-1: An Open Exploration to a Unified Motion Foundation Model,32,1,1784553072,hasheddan,https://yang-ai-lab.github.io/Inertia-1/,False
48980506,"Ziggity – A terminal UI for Git, written in Zig",10,3,1784562378,TheSorcerer,https://github.com/simoarpe/ziggity,False
48980167,Show HN: Wheesper – Start an anonymous discussion with a link,11,14,1784561030,whatdoyouthink2,https://wheesper.com/,False
48980375,"SaaS *is* dead. But not because AI ""killed"" it, because AI killed it",11,4,1784561895,avivcarmis1,https://avivcarmi.com/saas-is-dead/,False
48978192,Soofi – Sovereign Open Source Foundation Models,25,9,1784551923,Fake4d,https://www.soofi.info/,False
48910259,"Another Entry in the ""Stuff Im Glad Im Not Responsible for"" Ledger",6,1,1784050305,c_f_,https://blog.cloudflare.com/dnssec-nta-ede-33/,False
48969530,ECC and DDR5,78,65,1784478704,zdw,https://etbe.coker.com.au/2026/07/19/ecc-ddr5/,False
48978112,Annoying and alarming things about OpenCode,309,214,1784551555,alekq,https://wren.wtf/shower-thoughts/stop-using-opencode/,False
48979010,Tested Kimi K3 for Coding,25,6,1784556093,speckx,https://www.dotnetperls.com/2026_7_18_tested-kimi-k3-coding,False
48980404,Cross sectioning insects in an electron microscope with a femtosecond laser [video],4,0,1784562003,surprisetalk,https://www.youtube.com/watch?v=NwhVJ7cv9B4,False
48952713,What does the Riemann zeta function have to do with the distribution of primes?,83,16,1784325738,mb1699,https://hidden-phenomena.com/articles/rh,False
48953189,Sensing warm and cool: how the body detects temperature changes,33,5,1784329568,hhs,https://news.uq.edu.au/2026-07-sensing-warm-and-cool-how-body-detects-temperature-changes,False
48972970,Moonshine: Lets you stream games from your PC to any device running Moonlight,306,128,1784506610,wertyk,https://github.com/hgaiser/moonshine,False
48917906,Sealed tomb filled with paintings and inscriptions discovered in Egypt,112,78,1784104546,isaacfrond,https://www.labrujulaverde.com/en/2026/07/sealed-tomb-of-a-high-official-or-priest-filled-with-paintings-and-inscriptions-discovered-on-luxors-west-bank/,False
48940641,We rewrote our custom visualisation renderers from SVG to be in Canvas,17,1,1784238042,yomieluwande,https://www.polarsignals.com/blog/posts/2026/07/14/new-and-faster-profiler,False
48977849,The footprints of every building in NYC – updated weekly,19,2,1784550349,jonathanmkeegan,https://www.beautifulpublicdata.com/the-footprints-of-every-building-in-nyc/,False
48979734,The ACLU Is Arming Lawyers to Expose State Surveillance Secrets,23,2,1784559312,Brajeshwar,https://www.wired.com/story/the-aclu-is-arming-lawyers-to-expose-state-surveillance-secrets/,False
48979822,Caffeine and Cardiovascular Disease: AHA Scientific Statement,32,13,1784559627,brandonb,https://www.ahajournals.org/doi/epub/10.1161/CIR.0000000000001454,False
48899449,"Primate 0.40: Route pages, store enums, async schemas and events",12,6,1783979792,terrablue,https://primate.run/blog/primate-040,False
48933948,Moist Towelette Museum,66,16,1784207112,bookofjoe,https://moisttowelettemuseum.com/,False
48936994,1-Bit LLM in the Browser,103,42,1784220632,simonebrunozzi,https://huggingface.co/spaces/webml-community/bonsai-webgpu,False
48979263,Model 4: Our best model yet for local dictation and cleanup on Mac,8,0,1784557289,oakst,https://www.epilude.com/news/introducing-model-4,False
48974325,LoRA Speedrun – a public wall-clock leaderboard for fine-tuning techniques,128,25,1784521488,Vineeth147,https://github.com/Saivineeth147/lora-speedrun,False
48979990,AliExpress hit with record $629M fine for counterfeit and illegal goods,29,6,1784560270,speckx,https://www.engadget.com/2218530/aliexpress-hit-with-record-629-million-fine-for-selling-counterfeit-and-illegal-products/,False
48968606,"Show HN: I replaced a $120k bowling center system with $1,600 in ESP32s",2745,319,1784472076,section33,,False
48908884,Eliminating Go bounds checks with unsafe,42,19,1784044917,abnercoimbre,https://blog.andr2i.com/posts/2026-07-06-eliminating-go-bound-checks-with-unsafe,False
48921578,Show HN: Stacks – an hourly card solitaire about building four gardens,13,7,1784126421,sungchi,https://plan9.kr/stacks/,False
48980909,FCC pays $340k/year to keep 100's of empty Alaska buildings wired for internet,10,3,1784564152,Teever,https://www.propublica.org/article/adak-island-alaska-internet-subsidy-fcc,False
48978026,Programming the Amiga and Atari ST in C: Reading Keyboard Input,7,0,1784551198,ibobev,https://retrogamecoders.com/st-amiga-vbcc-c-input-echo/,False
48974454,Xiaomi-Robotics-1,396,275,1784522715,ilreb,https://robotics.xiaomi.com/xiaomi-robotics-1.html,False
48980119,Trial Lawyers Lobby Against Autonomous Vehicles,10,2,1784560831,duringmath,https://marginalrevolution.com/marginalrevolution/2026/07/trial-lawyers-lobby-against-autonomous-vehicles.html,False
48976361,Introduce a memory safe compilation mode inspired by Fil-C,36,19,1784540157,mpweiher,https://codeberg.org/ziglang/zig/issues/36237,False
48980359,A 600-acre AI data center could cost some Wisconsin residents their land,9,1,1784561795,1vuio0pswjnm7,https://abcnews.com/US/600-acre-ai-data-center-cost-wisconsin-residents/story?id=130153006,False
48978961,Show HN: A Pipeline for Making 10-minute AI Movies with Claude Code and Seedance,6,1,1784555864,dawndrain,https://github.com/dawndrain/movie-gen,False
48978942,Visualizing the Artemis II Mission,3,0,1784555783,intrepidsoldier,https://foxglove.dev/blog/visualizing-the-artemis-ii-mission,False
48978145,The Reverse Information Paradox (Satya Nadella),5,0,1784551719,adletbalzhanov,https://snscratchpad.com/posts/reverse-information-paradox/,False
48978331,Codex is wearing out our devices,55,30,1784552681,spenvo,https://old.reddit.com/r/codex/comments/1v0m3lt/codex_is_wearing_out_our_devices/,False
48978752,Jacobian conjecture is false (with help of Fable),22,1,1784554734,k2xl,https://twitter.com/__alpoge__/status/2079028340955197566,False
48966120,Qwen 3.8,928,669,1784450697,nh43215rgb,https://twitter.com/Alibaba_Qwen/status/2078759124914098291,False
48928703,"11,700 Free Photos from John Margolies' Archive of Americana Architecture",94,4,1784159099,gslin,https://www.openculture.com/2026/07/free-photos-from-john-margolies-archive-of-americana-architecture.html,False
48978545,Modder Makes GTA: Vice City Playable Inside GTA 3 Inside GTA: San Andreas,27,6,1784553818,sam_anthony,https://kotaku.com/gta-vice-city-made-playable-in-gta-3-made-playable-in-gta-san-andreas-2000717510,False
48978276,NYC Roam: 3D world with real transit and building data,5,2,1784552356,heresalexandria,https://www.nycroam.com/,False
48980966,What's Behind the Rise in Mild Autism?,5,2,1784564402,bookofjoe,https://www.theatlantic.com/family/2026/07/mild-autism-diagnosis/687998/,False
48966569,Claude Code uses Bun written in Rust now,589,794,1784455403,tosh,https://simonwillison.net/2026/Jul/19/claude-code-in-bun-in-rust/,False
48978191,Datasette-plot – Datasette Plugin for building data visualizations,6,0,1784551923,ankitg12,https://www.datasette.cloud/blog/2023/datasette-plot/,False
48979333,Police searched Twin Cities Flock cameras during ICE surge,13,2,1784557572,bradleyankrom,https://www.startribune.com/police-search-immigration-twin-cities-flock-license-plate-cameras-ice-dhs-metro-surge/601807825,False
48967355,I burned all my tokens researching how to save tokens,163,202,1784462513,bkotrys,https://quesma.com/blog/custom-deep-research-pipeline/,False
48979904,It Might Be Time to Grow Your Own Lettuce,6,2,1784559946,speckx,https://nymag.com/strategist/article/cyclosporiasis-grow-your-own-lettuce.html,False
48913656,Who Is America's Homer?,104,219,1784067553,samclemens,https://www.plough.com/articles/who-is-americas-homer,False
48908433,Dupes took over the world,110,122,1784043222,gumby,https://www.vox.com/podcasts/493930/dupe-culture-fender-ugg-quince-tiktok-amazon-online-shopping,False
48969983,HMD Touch 4G,90,105,1784481903,thisislife2,https://www.hmd.com/en_int/hmd-touch-4g,False
48970894,Orion Browser by Kagi,286,261,1784488409,sebjones,https://orionbrowser.com/,False
48979110,Firefox 153.0 Beta,56,50,1784556583,Erenay09,https://www.firefox.com/en-US/firefox/153.0beta/releasenotes/,False
48966713,"What I learned selling 2,500 MIDI recorders: Hardware is not so hard",541,243,1784457298,chipweinberger,https://chipweinberger.com/articles/20260719-hardware-is-not-so-hard,False
48968949,C64 Basic Dungeon Crawler: Goblin Attack (C64 Basic Part 8),86,6,1784474422,ibobev,https://retrogamecoders.com/c64-basic-dungeon-part8/,False
48860719,Cagire: Live Coding in Forth,104,16,1783694733,surprisetalk,https://cagire.raphaelforment.fr,False
48920597,Talk: The Art of Braiding Algorithms,52,1,1784122304,surprisetalk,https://pgadey.ca/notes/talk-relatorium-2026/,False
48974292,When can a power company take your land for data center infrastructure?,154,134,1784521162,1vuio0pswjnm7,https://theconversation.com/when-can-a-power-company-take-your-land-for-data-center-infrastructure-284061,False
48979905,Netflix Paid $587M for Ben Affleck's AI Startup InterPositive,6,1,1784559949,caseysoftware,https://variety.com/2026/film/news/netflix-paid-587-million-ben-affleck-ai-interpositive-1236815111/,False
48979363,"After five failed products, this founder quit his job and hit $7.5k/mo",6,4,1784557719,jimwilson,https://www.indiehackers.com/post/tech/after-five-failed-products-this-founder-quit-his-job-and-hit-7-5k-mo-in-12-months-xaDBfmynasknHQkim3sO,False
48968515,Terence McKenna's Mega Bad Trip (2025),115,102,1784471431,Dimmiwoah,https://psychedelics.community/cultural-icons/terence-mckennas-mega-bad-trip,False
48980448,Homeowner may lose 1/3 of her property to data center high-voltage power line,3,1,1784562183,1vuio0pswjnm7,https://www.nbcwashington.com/news/local/weve-been-sacrificed-homeowner-may-lose-1-3-of-her-property-to-high-voltage-power-line-for-data-cente/4128713/,False
48979718,Google Is Building an A.I. Fence Around the Internet It Once Championed,7,0,1784559267,jsphweid,https://www.nytimes.com/2026/07/20/technology/google-ai-open-web.html,False
48968701,Natural experiments prove phytoplankton carbon removal works,73,29,1784472717,getnormality,https://www.onepercentbrighter.com/p/natural-experiments-prove-feeding,False
48967256,Minecraft: Java Edition now uses SDL3,345,250,1784461698,ObviouslyFlamer,https://www.minecraft.net/en-us/article/minecraft-26-3-snapshot-4,False
48911021,Blender 5.2 LTS,413,183,1784053367,makizar,https://www.blender.org/download/releases/5-2/,False
48971938,Biggest Probabilistic Computer Turns Noise into Answers,80,14,1784497332,rbanffy,https://spectrum.ieee.org/biggest-probabilistic-computer,False
48965850,OpenAI reduces Codex Model Context Size from 372k to 272k,360,164,1784447679,AmazingTurtle,https://github.com/openai/codex/pull/33972/files,False
48973869,Claude Fable produced a counterexample to the Jacobian Conjecture,606,368,1784515876,loubbrad,https://xcancel.com/__alpoge__/status/2079028340955197566,False
48978358,Where B2B Buyers Ask on Reddit: 30 Days of Scan Data,6,4,1784552864,tgdaimov,https://cuescout.com/blog/where-b2b-buyers-actually-ask-on-reddit,False
48979274,People are turning themselves into lab rats': peptides craze the US,7,0,1784557334,wslh,https://www.theguardian.com/wellness/2026/feb/05/injectable-peptides-trend,False
48907564,Korg PS-3300 is back,63,60,1784039612,Lio,https://www.korg.co.uk/blogs/updates/ps3300,False
48979973,The Rise and Gruesome Implosion of 'Woke Capital',3,1,1784560227,anonymousiam,https://cityjournal.substack.com/p/the-spectacular-rise-and-gruesome,False
48962600,UnifiedIR for Julia,99,20,1784410118,vimarsh6739,https://github.com/JuliaLang/julia/pull/62334,False
48963879,Transcribe.cpp,755,160,1784421506,sebjones,https://workshop.cjpais.com/projects/transcribe-cpp,False
48971566,A new Intel Itanium (IA-64) emulator that boots Windows,82,74,1784494242,jandeboevrie,https://raymii.org/s/blog/Intel_Itanium_IA-64-Emulator_that_boots_Windows.html,False
48891334,"Land Atlas – soil, farmability, and crop analysis for land listings",70,21,1783943912,L3dge,https://land-atlas-production.up.railway.app/welcome,False
48979868,Road traffic noise and risk of Parkinson disease,3,0,1784559808,geox,https://jamanetwork.com/journals/jamaneurology/fullarticle/2851756,False
48969291,Moonshot AI suspends new subscriptions due to Kimi K3 demand,276,109,1784476945,serialx,https://twitter.com/kimi_moonshot/status/2078855608565207130,False
48907390,The Zen of Parallel Programming,184,32,1784039006,edgar_ortega,https://smolnero.com/posts/the-zen-of-parallel-programming,False
48966769,The death and rebirth of my home server,136,104,1784457871,steinuil,https://sgt.hootr.club/blog/home-server-rebirth/,False
48968063,Bananas sprout in Rayleigh Garden UK after 15 years,181,135,1784467769,teleforce,https://www.bbc.com/news/articles/cvg8edqq5g5o,False
48861496,Self-Powered Trailers Promise Leaner Freight Runs,60,58,1783698276,rbanffy,https://spectrum.ieee.org/self-powered-trailers-freight-decarbonization,False
48980238,Jaron Lanier: there is no AI (2023),28,57,1784561312,simonebrunozzi,https://www.newyorker.com/science/annals-of-artificial-intelligence/there-is-no-ai,False
48978958,Flock License Plate Tracking Cameras,6,1,1784555846,pavel_lishin,https://www.schneier.com/blog/archives/2026/07/on-flock-license-plate-tracking-cameras.html,False
48970772,HomeLab #1: MikroTik as a Home Router,154,123,1784487421,rafal_opilowski,https://justsomebody.dev/blog/mikrotik-home-router,False
48974476,How proprietary formats have become Microsoft’s main tool for lock-in,144,113,1784522987,cube00,https://blog.documentfoundation.org/blog/2026/07/17/microsofts-main-tool-for-lock-in/,False
48969635,The Last MPEG-4 Visual Patent Has Expired,223,70,1784479517,LorenDB,https://www.phoronix.com/news/Last-MPEG-4-Patent-Expired,False
48965719,The Art of Insight in Science and Engineering – Mastering Complexity(2014) [pdf],84,5,1784446057,nill0,https://ocw.mit.edu/courses/res-6-011-the-art-of-insight-in-science-and-engineering-mastering-complexity-fall-2014/3bca850386a3005c22134fa62fb3bad5_MITRES_6-011F14_art_insfin.pdf,False
48979461,ASML to offer employees €20k retention bonus for staying in 2027-2030,4,4,1784558045,tartoran,https://www.reuters.com/business/world-at-work/asml-offer-employees-20000-retention-bonus-staying-2027-2030-2026-07-20/,False
48960218,The Kimi K3 Moment,623,598,1784395960,sbochins,https://stephen.bochinski.dev/blog/2026/07/18/the-kimi-k3-moment/,False
48911793,Speech Recognition and TTS in less than 500kb,561,85,1784057110,petewarden,https://github.com/moonshine-ai/moonshine/tree/main/micro,False
48966984,"I joined the IndieWeb, here's what I learned",231,149,1784459678,andros,https://en.andros.dev/blog/0b8e451e/i-joined-the-indieweb-heres-what-i-learned/,False
48904269,Making Software: How to make a font,112,14,1784022089,Garbage,https://www.makingsoftware.com/chapters/how-to-make-a-font,False
48978565,"Show HN: A 16-control subtractive synth for microcontrollers (39k ELF, web demo)",5,0,1784553946,isitcontent,https://mini000.itch.io/beeper,False
48926307,Ise Jingu and the Pyramid of Enabling Technologies (2021),17,5,1784145578,NaOH,https://www.scopeofwork.net/ise-jingu-and-the-pyramid-of-enabling-technologies/,False
48979282,Investigating why RustCrypto is slow: Deep dive into SIMD acceleration,5,0,1784557375,cold_pizz4,https://kerkour.com/rustcrypto-slow-simd-rust,False
48971738,AI advice made people less accurate but more confident – sudy,351,202,1784495890,rbanffy,https://thenextweb.com/news/ai-advice-suppresses-critical-thinking-wrong-answers-study,False
48976682,Airbus Takes Flight from AWS,172,152,1784542342,bbg2401,https://www.theregister.com/columnists/2026/07/20/airbus-takes-flight-from-aws-what-happens-next-is-critical/5274109,False
48903717,"Infinities, impossibilities, and the man in the white linen suit",84,54,1784017494,iainharper,https://iain.so/infinities-impossibilities-and-the-man-in-the-white-linen-suit,False
48972062,We want Texans to know their rights,205,66,1784498591,amarcheschi,https://www.eff.org/deeplinks/2026/07/we-want-texans-know-their-rights-qa-mayday-health-impact-surveillance-abortion,False
48969051,Show HN: Bribes.fyi – Built something to report bribes,44,37,1784475106,neverenderr,https://bribes.fyi/,False
48980718,Georgia residents homes seized by private company in $16B AI data center plan,10,1,1784563309,1vuio0pswjnm7,https://nypost.com/2026/05/21/real-estate/residents-fume-as-georgia-power-seizes-homes-under-eminent-domain/,False
48965161,Scrying the AMD GFX1250 LLVM Tea Leaves,66,10,1784437628,mfiguiere,https://chipsandcheese.com/p/scrying-the-amd-gfx1250-llvm-tea,False
48957779,GPT-5.6 used a prompt to close a 30-year gap in convex optimization,596,390,1784379652,mbustamanter,https://old.reddit.com/r/math/comments/1uxj3cy/after_openais_cdc_proof_announcement_gpt56_used_a/,False
48877124,A Visual Catalog of Retro Macintosh Software,84,8,1783815734,zdw,https://www.marciot.com/mac68k-visual-catalog/,False
48948800,Building an Arch Linux Aarch64 Port for Holo Core,39,11,1784303425,losgehts,https://www.collabora.com/news-and-blog/news-and-events/building-an-arch-linux-aarch64-port-for-holo-core.html,False
48978139,Hugging Face Data Breach,5,0,1784551681,dotmanish,https://techcrunch.com/2026/07/20/hugging-face-confirms-breach-affected-internal-datasets-and-credentials-urges-users-to-take-action/,False
48977128,Who's Afraid of Chinese Models?,11,1,1784545558,mfiguiere,https://stratechery.com/2026/whos-afraid-of-chinese-models/,False
48935342,Kimi K3: Open Frontier Intelligence,2090,1206,1784213165,vincent_s,https://www.kimi.com/blog/kimi-k3,False
48945241,AWS: Inaccurate Estimated Billing Data – $1.7 billion,1306,753,1784281325,nprateem,,False
48960607,"REO Trucks I4 4WD Pickup Truck Starts at $21,500",112,241,1784398385,b_mc2,https://reotrucks.com,False
48961157,What's the deal with all the random weekly quota resets for agents lately?,82,88,1784401583,minimaxir,https://minimaxir.com/2026/07/agent-quota-reset/,False
48974563,New Mexico Denies Gas Pipeline Permit for Oracle Data Center,33,3,1784524184,1vuio0pswjnm7,https://www.bloomberg.com/news/articles/2026-07-16/new-mexico-denies-gas-pipeline-permit-for-oracle-data-center,False
48963465,Codex Resets,305,194,1784417066,denysvitali,https://codex-resets.com/,False
48973847,Tech Workers Face Evaporating Financial Security as AI Transforms Industry,43,29,1784515514,nlpnerd,https://www.adn.com/nation-world/2026/07/19/the-biggest-winners-of-the-american-economy-fear-theyre-sinking-fast/,False
48893346,From Muon to Gradient Clipping: Some Thoughts on QK Stability,28,0,1783953151,Eridanus2,https://MasterGodzilla.github.io/posts/2025/07/muon-clip/,False
48959090,"If You Build It, They Will Come",467,205,1784389021,barry-cotter,https://www.benlandautaylor.com/p/if-you-build-it-they-will-come,False
48905836,Using self-hosted Umami for iOS app analytics,64,9,1784032481,Sankra,https://hjerpbakk.com/blog/2026/07/14/umami-for-apps,False
48875738,Restoring and Demoing 1960s Vintage Computers at the Computer History Museum [pdf],43,3,1783803088,rbanffy,https://ibm-1401.info/pictures/Proc-MIW-2017-Garner-1401PDP1.pdf,False
48977719,Thousands of students are attempting to march to India's parliament,6,0,1784549710,tirumaraiselvan,https://www.bbc.com/news/videos/c0qvdywj97ko,False
48895861,Mathematicians still don't know the fastest way to multiply numbers,228,140,1783963270,beardyw,https://www.scientificamerican.com/article/mathematicians-still-dont-know-the-fastest-way-to-multiply-numbers/,False
48970991,Modder Runs GTA III Inside GTA: San Andreas on an In-Game TV,105,24,1784489236,croes,https://videocardz.com/newz/modder-runs-gta-iii-inside-gta-san-andreas-on-an-in-game-tv,False
48973513,Let's compile like it's 1992,7,1,1784511736,andsoitis,https://fabiensanglard.net/Compile_Like_Its_1992/index.php,False
48920328,Searchable field-level encryption on Supabase with CipherStash,47,48,1784121001,dandraper,https://supabase.com/blog/searchable-field-level-encryption-with-cipherstash,False
48954851,Regressive JPEGs,719,69,1784344460,vitaut,https://maurycyz.com/projects/bad_jpeg/,False
48979815,Capping the price of healthcare is a mistake,6,1,1784559603,brandonb,https://www.nytimes.com/2026/07/20/opinion/health-care-prices-insurance-caps.html,False
48958854,Show HN: Q3Edit – Edit and play Quake 3 maps in the browser,101,26,1784387560,drdator,https://q3edit.com,False
48956231,The Computer at the Bottom of a Canal,181,46,1784363611,Kudos,https://negroniventurestudios.com/2026/07/18/the-computer-at-the-bottom-of-a-canal/,False
48977448,Countries with more tourists than locals,4,1,1784548090,teleforce,https://www.visualcapitalist.com/ranked-countries-with-more-tourists-than-locals/,False
48956949,What AI did to stackoverflow in a graph,474,560,1784373166,secretslol,https://data.stackexchange.com/stackoverflow/query/1953768#graph,False
48975419,Nolan's Odyssey – A technical analysis by a nitpicky Classics student,24,7,1784533016,lylo,https://earlrambles.pagecord.com/nolans-odyssey-a-very-technical-analysis-by-a-very-nitpicky-classics-student,False
48895763,A Second-Grade Teacher Revived a Beloved Video Game,96,34,1783962802,danso,https://www.nytimes.com/2026/07/13/style/backyard-baseball-video-game-teacher.html,False
48962758,Hardcore IndieWeb: Run your own website 100% independently for only $0.01/day,254,201,1784411112,cdrnsf,https://www.neatnik.net/hardcore-indieweb,False
48966044,Anthropic runs large-scale code migrations with Claude Code,35,31,1784449875,vinhnx,https://claude.com/blog/ai-code-migration,False
48955042,Show HN: IKEA Complexity Index,178,87,1784346702,gregsadetsky,https://ikea.greg.technology/,False
48965880,Ollama: All Aboard Open Models,135,55,1784447984,inferhaven,https://ollama.com/blog/all-aboard-open-models,False
48962429,Co-evolution of self-replication and function in a digital primordial soup,90,29,1784408941,vicgalle_,https://arxiv.org/abs/2607.09211,False
48964185,AI Mania Is Eviscerating Global Decision-Making,424,269,1784424559,subset,https://ludic.mataroa.blog/blog/ai-mania-is-eviscerating-global-decision-making/#fnref:3,False
48964015,Better and Cheaper Than IPTV,343,104,1784422795,xonery,https://github.com/stupside/castor,False
48978067,E-scooters set to be banned for under-18s,3,1,1784551347,austinallegro,https://www.rte.ie/news/ireland/2026/0720/1584131-escooters-ireland-meeting/,False
48971847,Show HN: A canvas-based note taking and organizer app,60,32,1784496708,passiflora96,https://www.passinote.app/,False
48951756,Tech note: making your own V-I plots at home,85,10,1784319002,zdw,https://lcamtuf.substack.com/p/tech-note-making-your-own-v-i-plots,False
