id,title,score,num_comments,created_utc,author,url,is_ask_hn
48977081,AI is more likely than humans to form biases when hiring,8,0,1784545267,joozio,https://www.technologyreview.com/2026/07/20/1140655/ai-biases-hiring-humans/,False
48968348,"Clever hacker fits 537,000 domains in a $5 ESP32 ad-blocking dongle",93,27,1784470027,sbulaev,https://www.tomshardware.com/networking/clever-hacker-fits-537-000-domains-in-a-tiny-usd5-esp32-ad-blocking-dongle-firmware-uses-only-around-50kb-of-ram-and-can-answer-blocked-lookups-in-10-milliseconds,False
48964424,I built a browser-based P2P file transfer tool using WebRTC,44,21,1784427423,SamOkampo,https://airdows.com/,False
48947560,First atmosphere found on Earth-like planet in habitable zone of distant star,536,310,1784297173,neversaydie,https://www.bbc.com/news/articles/cy4kdd1e0ejo,False
48959297,Our Approach to Bioresilience: Isomorphic Labs and Google DeepMind,83,23,1784390565,bookofjoe,https://deepmind.google/blog/our-approach-to-bioresilience/,False
48949551,Thanks HN for 15 years of support and helping me find my life's work,821,104,1784307447,nicholasjbs,,False
48951898,Static search trees: 40x faster than binary search (2024),197,15,1784319895,lalitmaganti,https://curiouscoding.nl/posts/static-search-tree/,False
48960155,"Goodbye, and Thanks for All the Bikesheds",291,262,1784395644,Ygg2,https://queue.acm.org/detail.cfm?id=3818307,False
48965914,The Mighty Big Array of Finn Jensen LA8YB,29,7,1784448346,kalehmann,https://la0by.darc.de/LA8YB_EME_MBA.htm,False
48926594,GTX 1080s: Testing a Legend,111,53,1784147141,LabsLucas,https://www.lttlabs.com/articles/2026/07/15/gtx-1080s-revisiting-legends,False
48916541,Developing an Intuitive Sense of Scale,36,10,1784092435,vismit2000,https://magworld.pw,False
48967406,Study: Single-crystal nanowires of niobium arsenide may replace copper wires,13,2,1784462892,giuliomagnifico,https://news.cornell.edu/stories/2026/07/too-thin-fail-alternative-copper-microchip-interconnects,False
48959392,"Setting up your spare Mac for Claude Code to control, a step-by-step guide",248,189,1784391128,ykev,https://ykdojo.github.io/claude-controls-mac/,False
48951780,Painting the sides of railroad rails white to reduce derailment,151,92,1784319179,zdw,https://www.up.com/news/safety/Tracking-Rail-Heat-260608,False
48979926,Apps Marketed to US Troops Are Shipping Chinese and Russian Code,5,0,1784560032,sbulaev,https://www.wired.com/story/apps-marketed-to-us-troops-are-shipping-chinese-and-russian-code/,False
48854988,Camera Chase Vehicle,259,25,1783649875,geerlingguy,https://transistor-man.com/gimbal_camera_rover.html,False
48967807,Claude Code skill for searching royalty-free stock photos via the Pexels API,15,1,1784465711,amalshehu,https://github.com/amalshehu/pexels-skill,False
48852151,How GitHub gave every repository a durable owner,87,25,1783630029,ascertain,https://github.blog/security/application-security/how-github-gave-every-repository-a-durable-owner/,False
48956879,Fable 5 vs. GPT-5.6 Sol on an NP-Hard Problem: Does /goal help?,257,125,1784372429,couAUIA,https://charlesazam.com/blog/fable-5-gpt-5-6-sol-goal/,False
48961504,"Typing Speed Test, but for Developers",108,74,1784403501,hronecviktor,https://haxxorwpm.0s.is/,False
48954149,I started a “dirt notebook”,121,99,1784337133,herbertl,https://pinewind.bearblog.dev/i-started-a-dirt-notebook/,False
48933310,The LLM Critics Are Right. I Use LLMs Anyway,310,306,1784203141,JeremyTheo,https://www.theocharis.dev/blog/llm-critics-are-right-i-use-llms-anyway/,False
48964243,IceCream – Never use print() to debug again,35,21,1784425144,gregsadetsky,https://github.com/gruns/icecream,False
48962838,"Classic Amiga titles, free to download",175,26,1784411727,doener,https://amigafreeware.downer.tech/,False
48980351,Chinese AI Open Weights Grow Safer as American AI Becomes Dead Weight,3,0,1784561768,speckx,https://www.flyingpenguin.com/chinese-ai-open-weights-grow-safer-as-american-ai-becomes-dead-weight/,False
48973715,Delete Your Data with Drop,30,5,1784513962,mooreds,https://privacy.ca.gov/,False
48920945,The Chickens and the Bulls (2012),6,0,1784124020,robtherobber,https://slate.com/human-interest/2012/07/the-chickens-and-the-bulls-the-rise-and-incredible-fall-of-a-vicious-extortion-ring-that-preyed-on-prominent-gay-men-in-the-1960s.html,False
48975783,Apple probably won't add Jony Ive to OpenAI trade secret theft suit,9,0,1784535995,01-_-,https://appleinsider.com/articles/26/07/19/apple-probably-wont-add-jony-ive-to-openai-trade-secret-theft-suit,False
48956307,Qubes OS Security in the Public Record,91,18,1784364607,sciences44,https://arxiv.org/abs/2607.14587,False
48937398,CD sales growth outpaced vinyl in the first half of 2026,192,216,1784222356,speckx,https://consequence.net/2026/07/the-cd-revival-is-getting-hard-to-ignore/,False
48892021,"I'm Making Strandfall, a Solarpunk Orienteering Larp",172,21,1783947635,surprisetalk,https://mssv.net/2026/04/29/im-making-strandfall-a-solarpunk-orienteering-larp/,False
48894681,World GeoHistoGram,12,0,1783958423,rzk,https://textbooks.wmisd.org/worldgeohist.html,False
48959042,Elixir-lang.org has a new design,252,136,1784388724,bbg2401,https://elixir-lang.org/,False
48916044,Is this the end of the once-mighty GoPro?,232,549,1784087195,aanet,https://amateurphotographer.com/latest/photo-news/going-going-gone-is-this-the-end-of-the-once-mighty-gopro/,False
48962944,Real-Time LuaTeX: Recompiling Large Documents in 1ms [pdf],65,23,1784412547,amichail,https://www.tug.org/tug2026/preprints/lode-realtime.pdf,False
48973697,US health agency says cyclospora finding at produce company was false positive,22,13,1784513821,nianderwallace,https://www.cbc.ca/news/world/cyclospora-false-positive-taylor-farms-9.7276107,False
48942603,In-toto: A framework to secure the integrity of software supply chains,69,17,1784253638,Erenay09,https://in-toto.io/,False
48947548,Show HN: Watch bots interact with an SSH honeypot in real time,180,61,1784297115,tusksm,https://honeypotlive.cc/,False
48947490,Three ways people respond to a problem (other than solving it),274,164,1784296804,surprisetalk,https://improvesomething.today/responses-to-problems/,False
48973293,The Anti-Palantir Manifesto,74,24,1784509465,arkhiver,https://nonogra.ph/the-anti-palantir-manifesto-07-20-2026,False
48952135,Open Book Touch: open-source e-reader,171,58,1784321277,surprisetalk,https://www.crowdsupply.com/oddly-specific-objects/open-book-touch,False
48956688,LG monitors silently install software through Windows Update without consent,1211,632,1784370079,baranul,https://videocardz.com/newz/lg-monitors-silently-install-software-through-windows-update-without-user-consent,False
48952067,Topcoat: The full full-stack framework for Rust,125,46,1784320903,wertyk,https://github.com/tokio-rs/topcoat,False
48947717,"Kimi K3, and what we can still learn from the pelican benchmark",403,221,1784298111,droidjj,https://simonwillison.net/2026/Jul/16/kimi-k3/,False
48971669,"Show HN: ShipMD.app – Moving things in folders, move things in the real world",5,2,1784495354,bosky101,https://shipmd.app,False
48919562,"Show HN: LoopGain – Stop agent loops with control theory, not max_iterations",31,13,1784117268,fitz2882,https://github.com/loopgain-ai/loopgain,False
48947201,More Bounce to the Ounce,139,57,1784295131,pavel_lishin,https://mceglowski.substack.com/p/more-bounce-to-the-ounce,False
48959143,Gleam Is Now on Tangled,247,153,1784389444,nerdypepper,https://tangled.org/gleam.run/gleam,False
48951461,The Zilog Z80 has turned 50,287,119,1784317262,st_goliath,https://goliath32.com/blog/z80.html,False
48867701,Parsoid,28,3,1783734115,debo_,https://www.mediawiki.org/wiki/Parsoid,False
48946010,Evidence of inconsistencies in evaluation process and selection of winners,473,298,1784287800,twerkmeister,https://www.kaggle.com/competitions/kaggle-measuring-agi/discussion/724918#3498423,False
48907063,Reviving a 15-year-old netbook with Arch Linux,226,164,1784037756,parksb,https://parksb.github.io/en/article/41.html,False
48965918,Mirror your GitHub repos to tangled.org automatically,18,7,1784448418,wertyk,https://synchub.to/,False
48936426,Microsoft Comic Chat is now open source,809,178,1784217987,jervant,https://opensource.microsoft.com/blog/2026/07/16/microsoft-comic-chat-is-now-open-source/,False
48962893,Judge a book by its first pages,71,43,1784412151,bookofjoe,https://uncovered.ink,False
48887102,Frank Lloyd Wright’s first home,110,61,1783909399,NaOH,https://www.architecturaldigest.com/story/frank-lloyd-wright-home-and-studio-everything-you-need-to-know,False
48932697,Ente – Opening Our Books,288,110,1784198237,Sherex,https://ente.com/open/,False
48953981,Stenchill: 3D Printable Solder Paste Stencil Generator,83,26,1784335717,radeeyate,https://www.stenchill.com/en/,False
48924912,Inkling: Our Open-Weights Model,1221,291,1784139165,vimarsh6739,https://thinkingmachines.ai/news/introducing-inkling/,False
48970039,Neither GCC nor Clang are compliant with standard C++,47,57,1784482361,birdculture,https://sebsite.pw/w/20260708-badstdcxx.html,False
48930454,The lost joy of music piracy,842,602,1784177181,mcgin,https://www.pigeonsandplanes.com/read/music-piracy-what-cd-oink-nine-inch-nails-streaming,False
48935687,How to Train a Gen AI Kick Drum Model on Your Old Linux Desktop with 6GB VRAM,164,85,1784214780,zhinit,https://www.zhinit.dev/blog/training-a-kick-drum-diffusion-model,False
48896558,How the Elite See Rome,47,46,1783966563,bookofjoe,https://www.theatlantic.com/magazine/2026/08/rome-elite-tourism-imago-artis/687621/,False
48880258,"Waldi: A quiet place to write, and to be read",67,31,1783855606,waaldev,https://github.com/waaldev/waldi,False
48936584,Decoy Font,717,159,1784218701,ray__,https://www.mixfont.com/experiments/decoy-font,False
48962983,NYC may require landlords and realtors to disclose the use of AI in listings,587,264,1784412819,gnabgib,https://petapixel.com/2026/07/16/mayor-mamdani-says-landlords-cant-secretly-use-ai-images-to-advertise-properties/,False
48943142,"How Has Roman Concrete Lasted for Millennia? 1,900-Year-Old Latrine Offers Clues",273,219,1784260106,divbzero,https://www.smithsonianmag.com/smart-news/how-has-roman-concrete-lasted-for-millennia-a-1900-year-old-latrine-offers-new-clues-about-the-materials-impressive-durability-180989115/,False
48950122,Learning a few things about running SQLite,337,87,1784310341,surprisetalk,https://jvns.ca/blog/2026/07/17/learning-about-running-sqlite/,False
48896513,Latent Space as a New Medium,117,36,1783966329,thm,https://kevinkelly.substack.com/p/latent-space-as-a-new-medium,False
48970825,FIFA World Cup Triggers a Global Anti-Piracy Crackdown,35,11,1784487823,gslin,https://torrentfreak.com/fifa-world-cup-triggers-a-global-anti-piracy-crackdown/,False
48939896,Mathematics of Data Science,221,14,1784234328,Anon84,https://arxiv.org/abs/2607.11938,False
48964215,Deepsec,58,5,1784424812,handfuloflight,https://github.com/vercel-labs/deepsec,False
48965174,Inside the Secret Math Society Known Simply as Nicolas Bourbaki,20,6,1784437815,pykello,https://www.quantamagazine.org/inside-the-secret-math-society-known-as-nicolas-bourbaki-20201109/,False
48972082,Jurassic Park packed $4M of legit 1993 computer hardware,22,3,1784498827,sbulaev,https://www.tomshardware.com/desktops/jurassic-park-packed-usd4-million-of-legit-1993-computer-hardware-a-software-engineer-detailed-every-single-piece-of-hardware-in-the-film,False
48952565,TP-Link Kasa cameras leaked home GPS via unauthenticated UDP for 6 years,234,88,1784324563,BadChemical,https://github.com/BadChemical/IoT-Vulnerability-Research-Public/blob/main/TP-Link_Kasa_EC71/Kasa_EC71.md,False
48906171,An Update on Igalia's Layer Based SVG Engine in WebKit (Reducing Layer Overhead),73,4,1784033998,bkardell,https://blogs.igalia.com/nzimmermann/posts/2026-07-14-lbse-conditional-layers/,False
48939742,Helium escaping from atmosphere of nearby rocky exoplanet in a habitable zone,148,56,1784233442,anyonecancode,https://www.science.org/doi/10.1126/science.aea9708,False
48947714,AI Meets Cryptography 2: What AI Found in OpenVM's ZkVM,100,9,1784298095,duha,https://blog.zksecurity.xyz/posts/openvm-bugs/,False
48893081,Revisiting Yliluoma's ordered dither algorithm,42,10,1783952114,ibobev,https://30fps.net/pages/revisiting-yliluoma-2/,False
48933371,British Steel taken into public ownership to protect 'vital' UK supply,151,300,1784203553,clarionbell,https://www.bbc.com/news/articles/c5y680w62wno,False
48968690,Data center opponents stage 142 protests across 42 US states,44,34,1784472602,1vuio0pswjnm7,https://www.reuters.com/business/retail-consumer/us-data-center-protests-go-national-backlash-grows-2026-07-18/,False
48934286,Goes-19 weather satellite enters Safe Hold mode,177,92,1784208600,yabones,https://www.spaceweather.gov/news/goes-19-safe-hold,False
48949184,Designing emoji for the way we communicate today,72,98,1784305453,pentagrama,https://blog.google/products-and-platforms/platforms/android/world-emoji-day-noto-3d/,False
48883036,Teardown: A Generic 7-Port USB 3.0 Hub That Wasn't,235,105,1783879078,speckx,https://goughlui.com/2026/07/09/teardown-a-generic-7-port-usb-3-0-hub-that-wasnt/,False
48948693,Workspaces – Explore the workspaces of modern creators,93,68,1784302865,ryangilbert,https://workspaces.xyz/,False
48930136,"If you want to create a button from scratch, you must first create the universe",246,130,1784173723,treve,https://madcampos.dev/blog/2026/07/accessibility-from-scratch/,False
48971830,Fayetteville officers fired for misusing license plate system,24,7,1784496602,pir8life4me,https://www.fox5atlanta.com/news/3-fayetteville-officers-fired-misusing-license-plate-system,False
48896149,Vāgdhenu: A Sanskrit Chanting TTS System,212,53,1783964606,subinalex,https://prathosh.in/vagdhenu/,False
48970372,Less Is More: Why Audio on SoundCloud Looks Different,28,13,1784484612,1317,https://developers.soundcloud.com/blog/less-is-more-why-soundcloud-low-passes-its-aac-transcodings/,False
48971781,How to Abandon Your Climate Commitments and Get Away with It,68,42,1784496243,littlexsparkee,https://www.nytimes.com/2026/07/17/climate/company-climate-change-commitments-renege.html,False
48969582,Texas Police Spent $4.5M on Four Chevy Tahoes,137,64,1784479116,randycupertino,https://www.thedrive.com/news/how-texas-police-spent-4-5-million-on-four-chevy-tahoes,False
48929351,Bluesky Trademarks ATProto,199,149,1784164864,chaosharmonic,https://atproto.com/blog/at-protocol-trademark,False
48915709,Jurassic Park computers in excruciating detail,957,259,1784084267,vinhnx,https://fabiensanglard.net/jurrasic_park_computers/index.html,False
48975145,Britain: A Cautionary Tale for America,12,39,1784530457,barry-cotter,https://www.noahpinion.blog/p/the-uk-is-a-cautionary-tale-for-the,False
48870217,The kids with phones are alright,271,438,1783760888,JumpCrisscross,https://heatherburns.tech/2026/07/08/the-kids-with-phones-are-alright/,False
48933419,Sony deletes more movies from the accounts of people who ‘bought’ them,703,445,1784204023,nekusar,https://www.techdirt.com/2026/07/15/sony-deletes-a-bunch-more-movies-from-the-accounts-of-people-who-bought-them/,False
48923929,Funny item co-occurrences in 3.2M Instacart orders,52,92,1784135203,rogerdickey,https://rogerdickey.com/funny-item-co-occurrences-in-3-million-instacart-orders/,False
48964536,FDA approves new kind of cholesterol pill,104,64,1784428822,mgh2,https://www.fda.gov/news-events/press-announcements/fda-approves-first-oral-pcsk9-inhibitor-lower-ldl-cholesterol-adults-high-cholesterol,False
48878996,Faster binary search: from compiled code to mechanical sympathy,71,15,1783839624,enz,https://pythonspeed.com/articles/branchless-binary-search/,False
48973123,DeKalb deputy charged with Flock camera misuse; more Georgia officers fired,77,40,1784508092,pir8life4me,https://www.ajc.com/news/2026/07/3-more-georgia-police-officers-fired-over-alleged-flock-camera-misuse/,False
48932539,OnePlus halts operations in USA and Europe,596,366,1784196844,pilililo2,https://community.oneplus.com/thread/2170715118587871237,False
48946303,Apple targets dozens of OpenAI employees with legal letters,410,385,1784289759,merksittich,https://www.ft.com/content/1b8c9d52-88a9-426b-ba47-f1811f859166,False
48976172,US gas prices hit an average of $4 a gallon again,58,81,1784538730,geox,https://apnews.com/article/gas-prices-iran-war-4-gallon-4b82825734ec3ded192351e53a4be69e,False
48941315,"Battery packs: Let's talk about crates, baby",53,30,1784242124,MeetingsBrowser,https://smallcultfollowing.com/babysteps/blog/2026/07/15/battery-packs/,False
48975805,France doubles down on restricting access to Polymarketre,7,1,1784536136,01-_-,https://www.engadget.com/2218130/france-doubles-down-on-restricting-access-to-polymarket/,False
48884984,Ask HN: What Are You Working On? (July 2026),289,1128,1783891601,david927,,True
48975245,EU Exempts Apple Watch and AirPods from Battery Removal Requirements,41,67,1784531430,miohtama,https://mjtsai.com/blog/2026/07/17/eu-exempts-apple-watch-and-airpods-from-battery-removal-requirement/,False
48940833,'Likweli': A new monkey species discovered in the Congo Basin,119,31,1784239200,gmays,https://news.yale.edu/2026/07/15/meet-likweli-new-monkey-species-discovered-congo-basin,False
48971042,Show HN: Chalie – AI peer not employee,6,1,1784489640,dylangrech92,https://github.com/chalie-ai/chalie,False
48970677,M-Chips: M7 with up to 1.5 TB – and why Apple is skipping the M6,23,6,1784486802,danboarder,https://www.heise.de/en/news/M-Chips-M7-with-up-to-1-5-TB-and-why-Apple-is-skipping-the-M6-11362835.html,False
48946286,Advances in Real Time Rendering in Games,21,3,1784289693,oumua_don17,https://advances.realtimerendering.com,False
48943174,Pebble Mega Update – July 2026,272,191,1784260418,crazysaem,https://repebble.com/blog/pebble-mega-update-july-2026,False
48966219,Dumber Mini: A Nokia-Style Phone with WhatsApp and Maps,40,16,1784451734,thunderbong,https://dumbermini.com/,False
48936451,NotebookLM is now Gemini Notebook,371,185,1784218093,xnx,https://blog.google/innovation-and-ai/products/gemini-notebook/notebooklm-gemini-notebook/,False
48930397,Reynard: A real Firefox web browser for iOS 13 or later,169,55,1784176567,AbuAssar,https://github.com/minh-ton/reynard-browser,False
48952880,"Kaiser nurses say AI, surveillance are making their jobs and patient care worse",561,377,1784327190,gnabgib,https://localnewsmatters.org/2026/07/15/kaiser-nurses-say-ai-workplace-surveillance-are-making-their-jobs-and-patient-care-worse/,False
48911803,I also filed the corners off my MacBook,315,224,1784057141,maxbrt,https://www.brt.fyi/posts/mac-book-filing/,False
48935905,Schema Harness Achieves ~99% on Arc‑AGI‑3 Public,126,83,1784215752,jasondavies,https://schema-harness.github.io/,False
48933149,How Our Rust-to-Zig Rewrite Is Going,530,309,1784201967,jorangreef,https://rtfeldman.com/rust-to-zig,False
48923380,Collection of Digital Clock Designs,301,51,1784133195,levmiseri,https://clocks.dev,False
48933303,Let's Build PlanetScale from Scratch: Infrastructure,145,20,1784203089,onatm,https://onatm.dev/2026/07/16/homescale-part-1/,False
48910579,MoonBASIC: A modern BASIC for building 2D and 3D games,72,27,1784051586,klaussilveira,https://github.com/CharmingBlaze/moonbasic,False
48871547,Show HN: Clx – Compile Lua to Native Executables Through C++20,143,32,1783773624,_samt_,https://github.com/samyeyo/clx,False
48854168,"Vint Cerf, “father of the Internet”, is retiring",379,207,1783642019,compiler-guy,https://techcrunch.com/2026/06/30/the-father-of-the-internet-is-finally-retiring/,False
48971540,Why It's So Hard to Add a Column in the Middle of a PostgreSQL Table,14,9,1784493999,thunderbong,https://www.bytebase.com/blog/why-its-hard-to-add-a-column-in-the-middle-of-postgres-table/,False
48902320,Australian energy retailers must offer three hours of free daytime electricity,291,409,1784003508,i2oc,https://lenergy.com.au/free-daytime-electricity-is-coming-heres-how-it-actually-works/,False
48971418,"Heavy TV watching associated with smaller brain structures, study finds",106,65,1784492758,mashally,https://dornsife.usc.edu/news/stories/heavy-tv-watching-associated-with-smaller-brain-structures/,False
48908886,Pseudpocalypse,150,87,1784044921,surprisetalk,https://dynomight.net/pseudpocalypse/,False
48939524,$100 AI Music Video: Claude Fable 5 vs. GPT-5.6 Sol,396,536,1784232203,hershyb_,https://www.tryai.dev/blog/ai-music-video-arena-claude-vs-gpt-5.6,False
48946692,VulnHunter: Capital One's agentic AI code security tool,78,36,1784292132,medina,https://www.capitalone.com/tech/open-source/announcing-vulnhunter/,False
48899847,Lobste.rs is now running on SQLite,225,185,1783982149,abetusk,https://lobste.rs/s/ko1ji1,False
48967808,In-House LLM Serving at Netflix,5,0,1784465721,dalvrosa,https://netflixtechblog.com/in-house-llm-serving-at-netflix-a5a8e799ea2c?source=rss-c3aeaf49d8a4------2,False
48876811,Starlink from 1984,70,36,1783812392,ingve,https://nemanjatrifunovic.substack.com/p/starlink-from-1984,False
48972858,Ask HN: What are your favorite blogs not about AI?,85,36,1784505492,azhenley,,True
48915953,Stripe and Advent have made a joint offer to acquire PayPal – sources,493,304,1784086365,rvz,https://www.reuters.com/business/finance/stripe-advent-offer-buy-paypal-more-than-53-billion-sources-say-2026-07-15/,False
48919363,Sleep regularity is a stronger predictor of mortality risk than sleep duration (2023),754,407,1784115966,bilsbie,https://academic.oup.com/sleep/article/47/1/zsad253/7280269,False
48970228,Z80 turns 50 as an open-source drop-in replacement nears DIP40 silicon,17,2,1784483583,logickkk1,https://www.tomshardware.com/tech-industry/zilog-z80-turns-50-as-open-source-replacement-heads-for-drop-in-dip40-silicon,False
48967528,C Craft,7,0,1784463831,dhotson,http://www-cs-students.stanford.edu/~blynn/c/craft.html,False
48964585,LLM-Integrated Multivariable Calculus Course,40,46,1784429743,sinaatalay,https://calculus.academa.ai/,False
48972928,CO2 overload in blood suggests toxic atmosphere within 50 years,42,33,1784506208,veqq,https://doi.org/10.1007/s11869-026-01918-5,False
48966182,"Valve say there's no end in sight to the memory crisis, prices going to increase",55,34,1784451389,haunter,https://www.pcgamer.com/hardware/steam-machines/valve-says-theres-no-end-in-sight-to-the-memory-crisis-and-prices-are-only-going-to-increase-honestly-its-still-getting-worse/,False
48921077,Towards a harness that can do anything,216,107,1784124508,evakhoury,https://eardatasci.github.io/c/ambiance/index.html,False
48939662,LM Studio Bionic: the AI agent for open models,329,132,1784233095,minimaxir,https://lmstudio.ai/blog/introducing-lm-studio-bionic,False
48964815,How to prevent white clothes from turning yellow in storage,9,1,1784432876,teleforce,https://www.southernliving.com/how-to-pevent-white-clothes-from-turning-yellow-in-storage-12016122,False
48965736,Order of Magnitude Physics a Textbook with Applications to the Retinal Rod(1998) [pdf],7,0,1784446275,nill0,https://www.inference.org.uk/sanjoy/thesis/thesis-letter.pdf,False
48883578,"Today I Rescued 7,234 Old GIFs",149,24,1783882849,birdculture,https://danq.me/2026/07/10/rescuing-7234-gifs/,False
48903733,Job queues are deceptively tricky,142,48,1784017676,ingve,https://typesanitizer.com/blog/job-queues.html,False
48869989,Your 'app' could have been a webpage (so I fixed it for you),890,549,1783758087,MrVandemar,https://danq.me/2026/07/09/your-app-could-have-been-a-webpage/,False
48974426,Big tech needs to justify AI spending as investors dump stocks,43,14,1784522470,1vuio0pswjnm7,https://www.bloomberg.com/news/articles/2026-07-19/big-tech-needs-to-justify-ai-spending-as-investors-dump-stocks,False
48965687,"Show HN: PilotCite – Get your brand cited by ChatGPT, Gemini, and more",6,5,1784445470,standew,https://www.pilotcite.com,False
48913190,Microsoft has released software updates to plug at least 570 security holes,208,122,1784064742,robin_reala,https://krebsonsecurity.com/2026/07/microsoft-patches-a-record-570-security-flaws/,False
48952439,"FAA lets Boeing sign off on 737 MAX, 787 airworthiness certificates again",196,118,1784323373,hmm37,https://www.cnbc.com/2026/07/17/faa-boeing-737-max-787.html,False
48930075,Making 768 servers look like 1,154,84,1784173002,hisamafahri,https://planetscale.com/blog/making-768-servers-look-like-1,False
48922706,Launch HN: Coasty (YC S26) – An API for computer-use agents,44,26,1784130680,nkov47,https://coasty.ai/docs,False
48937020,Launch HN: Traceforce (YC S26) – Company-wide security monitoring for AI apps,43,26,1784220736,XiaHua,,False
48966745,The Economic Mirage of Local LLMs,5,0,1784457651,eamag,https://eamag.me/2026/the-economic-mirage-of-local-llms,False
48935951,Immersive Linear Algebra Book with Interactive Figures (2015),290,30,1784215943,srean,https://immersivemath.com/ila/,False
48926590,Grok Build is open source,588,640,1784147098,skp1995,https://github.com/xai-org/grok-build,False
48910545,Bonsai 27B: A 27B-Class model that runs on a phone,704,251,1784051448,xenova,https://prismml.com/news/bonsai-27b,False
48956852,Steam Machine: Between 12k and 15k Units Sold per week,112,97,1784372169,ekianjo,https://boilingsteam.com/steam-machine-between-10k-and-15k-sold-per-week/,False
48925888,"Duskers, the scary command line game, is getting a sequel",156,44,1784143679,spacemarine1,https://elbowgreasegames.substack.com/p/misfits-attic-announces-duskers-20,False
48958269,EU ban on destruction of unsold clothes and shoes enters into application,313,303,1784383482,robtherobber,https://environment.ec.europa.eu/news/ban-destruction-unsold-clothes-and-shoes-enters-application-2026-07-17_en,False
48959355,Fake food delivery site for the dopamine,108,68,1784390918,guerrilla,https://old.reddit.com/r/BingeEatingDisorder/comments/1uzr3ui/fake_food_delivery_site_for_the_dopamine/,False
