id,title,score,num_comments,created_utc,author,url,is_ask_hn
48979551,What Is AI Good At?,3,0,1784558496,ScottWRobinson,https://unstack.io/what-is-ai-good-at,False
48979540,Show HN: The Plato Programming Language,3,0,1784558435,d166e8,https://github.com/cdiggins/plato,False
48979539,Show HN: VoxThermic – A macOS journaling app that uses Apple's Foundation Models,3,0,1784558435,midnightbobarun,https://voxthermic.jbri.workers.dev/,False
48979508,GetOfflineDeviceUniqueID: How Windows Derives Its Offline Device ID,2,0,1784558296,mschuster91,https://iretq.com/inside-getofflinedeviceuniqueid-how-windows-derives-its-offline-device-id/,False
48979496,4playerchess: I launched a chess game that four people can play (easily),2,1,1784558226,emilemoureau,https://4playerchess.plus,False
48979474,Ask HN: I stopped fighting AI over-reliance and built a workflow around it,3,2,1784558111,dimonb19a,,True
48979470,Profunctor Optics,2,0,1784558102,ibobev,https://bartoszmilewski.com/2026/07/19/profunctor-optics/,False
48979469,Of forks and clones and package management,3,0,1784558088,ibobev,https://theconsensus.dev/p/2026/07/11/of-forks-and-clones-and-package-management.html,False
48979432,FDA says Taylor Farms cyclospora finding was a false positive,3,1,1784557968,NelsonMinar,https://www.reuters.com/business/healthcare-pharmaceuticals/fda-says-taylor-farms-cyclospora-finding-was-false-positive-2026-07-20/,False
48979428,Show HN: Compare public holidays across countries side by side,2,0,1784557954,weijunext,https://worldholidays.me,False
48979417,I Forgot to Get Excited,2,2,1784557893,bkaae,,False
48979413,Stagnant Germany Considers the Unthinkable: Sunday Shopping,3,0,1784557882,jacooper,https://www.wsj.com/world/europe/stagnant-germany-considers-the-unthinkable-sunday-shopping-13b4651c,False
48979395,Help: Using reflection to discovery and invoke methods,2,0,1784557831,ddddazed,,False
48979384,Google Images: 25 years of visual search innovation,2,0,1784557790,gmays,https://blog.google/products-and-platforms/products/search/google-images-25th-anniversary/,False
48979381,"Standalone webserver written in pure PHP. No more need for nginx, php-fpm, etc.",2,6,1784557784,EGreg,https://github.com/Qbix/webserver,False
48979370,"Logsum compresses log files to summary that matters, then ask your LLM",2,0,1784557743,fl_git,https://github.com/flouthoc/logsum,False
48979342,"Bits of Advice That, in Murky Light, Might Pass as Wisdom",2,0,1784557624,Pseudomanifold,https://bastian.rieck.me/blog/2026/40/,False
48979315,That's Still SOTA: Epistemic Cryogenics and the 2023 Fossil Layer,3,0,1784557491,ka_de,https://blog.sly.so/actually-i-prefer-myself.html,False
48979288,"Venv-manager, a Python venv runtime for Humans and AI agents",2,0,1784557406,twojacks,https://github.com/jacopobonomi/venv_manager,False
48979260,Fix Grid 9x9 Sudoku,3,0,1784557283,LeonardoYMG,https://zenodo.org/records/21434235,False
48979245,Guide to Rationalist Interior Decorating,1,0,1784557215,surprisetalk,https://www.lesswrong.com/posts/HJNtrNHf688FoHsHM/guide-to-rationalist-interior-decorating,False
48979242,Show HN: CharitySense Nonprofit Due Diligence,1,0,1784557207,mtweak,https://data.charitysense.com/,False
48979226,The cost of saying yes has changed,3,0,1784557138,edmorley,https://github.blog/engineering/the-cost-of-saying-yes-has-changed/,False
48979223,"Show HN: Sidereon: GNSS and Astrodynamics (Python, Rust, JavaScript, C, Elixir)",2,0,1784557126,nberkman,https://sidereon.dev,False
48979206,Cut to the Bone: Farmers at the Mercy of the Meat Monopolists,3,0,1784557021,petethomas,https://www.lighthousereports.com/investigation/cut-to-the-bone-farmers-at-the-mercy-of-the-meat-monopolists/,False
48979202,Windows Server Update Services buckle under Microsoft's metadata mountain,3,0,1784557006,speckx,https://www.theregister.com/systems/2026/07/20/windows-server-update-services-buckle-under-microsofts-metadata-mountain/5274843,False
48979201,Lossless model compression experiment: GLM-5.2 in 25% less memory,16,1,1784557005,hambandit,https://brianbell-x.github.io/weight-compression/,False
48979190,Show HN: Building a product for humans and AI agents,2,0,1784556959,slobodan_,https://slobodan.me/posts/introducing-competitor-tracker/,False
48979188,How to hire an AI-native product manager,2,0,1784556955,adamfaik,https://www.theaithinker.com/p/how-to-hire-an-ai-native-product,False
48979157,Moon Phase and Libration,3,1,1784556797,carlosjobim,https://svs.gsfc.nasa.gov/5415/,False
48979155,Show HN: Grid Words – sudoku meets Wordle meets crosswords,4,1,1784556770,jschomay,https://www.gridwordsgame.com/,False
48979132,GoCD MCP Server,2,0,1784556686,snikolaev,https://github.com/Ivinco/gocd-mcp,False
48979100,Automating Safari Extension Publishing with GitHub Actions,2,0,1784556538,rxliuli,https://rxliuli.com/blog/automating-safari-extension-publishing-with-github-actions/,False
48979086,We can now track animal panic from space. Here's why it matters,3,0,1784556457,speckx,https://www.bbc.com/future/article/20260521-tracking-animal-panic-from-space,False
48979042,Ahrefs free DR API Authentication starting August 10 2026,2,0,1784556245,rexthonyy,https://docs.ahrefs.com/en/api/reference/public/get-domain-rating-free,False
48979039,Hyprland 0.56 Released,4,0,1784556232,Erenay09,https://www.phoronix.com/news/Hyprland-0.56,False
48979033,Git email patch review addon for Thunderbird,4,0,1784556217,olexsmir,https://mccd.space/git/thunderbird-patch-review/file/README.html.html,False
48979017,Ask HN: Claude's Unexpected Blind Test: Users = Data = Value?,2,0,1784556121,Leewen,,True
48979014,Show HN: CodeTrain – an AI tutor that refuses to write code for you,2,2,1784556103,inferhaven,https://codetrain.ai,False
48979000,Frequently Asked Questions on Expertise,2,0,1784556029,surprisetalk,https://jtpeterson.substack.com/p/faq-on-expertise,False
48978989,Meta Garbage Collection: Using OCaml's GC to GC Rust,3,0,1784555989,annieversary,https://soteria-tools.com/blog/meta-garbage-collection,False
48978988,Thread: Differentiable Self-Organizing Systems,2,0,1784555988,lioeters,https://distill.pub/2020/selforg/,False
48978982,The Age of Founder Control,3,0,1784555968,robtherobber,https://tribunemag.co.uk/2026/07/the-age-of-founder-control,False
48978960,Sandbox Escape Vulnerabilities Across 4 Coding Agent Vendors,11,4,1784555859,fogeltine,https://www.pillar.security/blog/the-week-of-sandbox-escapes,False
48978950,Public Transport – Don't Make Me Think,3,0,1784555823,pavel_lishin,https://shkspr.mobi/blog/2026/07/public-transport-dont-make-me-think/,False
48978946,Show HN: Pathfinding Puzzle Game,2,0,1784555803,k2xl,https://pathology.thinky.gg/,False
48978938,Deterministic LLM router with a cryptographic audit trail – TEIA,2,0,1784555759,felippebarcelos,https://github.com/felippebarcelos/teia-omega-awakening,False
48978917,"The Washing-Machine Tragedy, by Stanisław Lem (1963)",3,0,1784555610,yesturi,https://www.newyorker.com/magazine/1981/11/30/the-washing-machine-tragedy,False
48978908,Democratizing Abandonware,3,0,1784555571,AdmiralAsshat,https://geopjr.dev/blog/democratizing-abandonware,False
48978901,Using LLM-Based Verification to Eliminate Bugs in Linux's Network Stack,3,0,1784555526,gopiandcode,https://www.basis.ai/blog/verified-nftables/,False
48978887,"Down with the Hierarchy: The ""H"" in HNSW Stands for ""Hubs""",2,0,1784555425,paldepind2,https://arxiv.org/abs/2412.01940,False
48978880,"Show HN: The0 – self-hosted runtime for trading bots, bring your own language",4,1,1784555393,mercutio93,https://github.com/alexanderwanyoike/the0,False
48978877,The Reranker Tax: When a Smart Layer Can't Save a Weak Foundation,4,0,1784555384,ehurrell,https://www.eoinhurrell.com/posts/20260717-the-reranker-tax/,False
48978857,I wrote an API client for my water-cooled bed,2,0,1784555316,birdculture,https://tinkering.xyz/bedctl/,False
48978848,Show HN: HN Comment Saver,5,2,1784555299,overflowy,https://github.com/overflowy/hn-comment-saver,False
48978841,Show HN: OTP Inspired actor supervisor based full stack templates,2,1,1784555249,annrap1d,https://shipstacks.net,False
48978828,Kevin O'Leary Is Happy Playing the Villain,3,1,1784555208,polina09,https://www.readtheprofile.com/p/kevin-oleary-mr-wonderful,False
48978761,Tasty,3,0,1784554806,surprisetalk,https://www.quarter--mile.com/tasty,False
48978714,Comprehensive JVM Primitive Hashtable Benchmarks,2,0,1784554569,tooilln,https://sooniln.github.io/posts/hashmap-benchmarks-2026/,False
48978707,A deep dive into my Forgejo setup,6,2,1784554548,alexfortin,https://a.l3x.in/blog/welcome-to-my-forge/,False
48978616,"Define less, check more: Pyrefly now supports attrs",6,0,1784554135,ocamoss,https://pyrefly.org/blog/pyrefly-attrs/,False
48978587,"The age of token efficiency, the age of libraries",4,0,1784554021,wtfdeveloper,https://golemui.com/blog/the-age-of-token-efficiency/,False
48978516,Show HN: QUBE Predict – A cloud platform for drug response prediction,2,0,1784553692,gfam999,https://qube-predict.streamlit.app/,False
48978508,"10x and 100x increase in CPU core and node bandwidth, respectively over 20 yrs",2,0,1784553667,teleforce,https://ieeexplore.ieee.org/document/11196478,False
48978503,Self-Service Ransomware as Security Against Local AI Tools,2,2,1784553654,BrKeaton,https://blog.brendankeaton.com/self-service-ransomware-as-security-against-local-ai-tools,False
48978497,Languages That Stretch Your DI Capabilities and Imagination,2,0,1784553603,surprisetalk,https://programmingsimplicity.substack.com/p/languages-that-stretch-your-di-capabilities,False
48978431,Apple should let us schedule work-hours notifications for specific apps,3,6,1784553245,hellowastaken,,False
48978408,What if your AI agent could have its own WhatsApp number?,2,4,1784553167,thiagocarboni,https://tyxter.com/,False
48978400,I predicted all WC2026 matches with Poisson Dixon-Coles – 64% accuracy,2,0,1784553125,dosores,https://predictive-model.com,False
48978394,Underwater Kites Harvest Power from Slow-Moving Tides,2,1,1784553111,speckx,https://spectrum.ieee.org/tidal-energy-underwater-kite-power,False
48978360,"Association of sedentary behaviors w cortical, subcortical &white matter volumes",2,0,1784552871,bookofjoe,https://alz-journals.onlinelibrary.wiley.com/doi/10.1002/alz.71582,False
48978353,The asymmetry problem: AI safeguards are mainly annoying to the good guys,2,0,1784552847,Versipelle,https://cephalosec.com/blog/the-asymmetry-problem-ai-safeguards-are-mostly-hindering-the-good-guys/,False
48978338,Landmark Science Report Confirms Big Oil's Fingerprints on Extreme Weather,3,0,1784552770,robtherobber,https://www.commondreams.org/newswire/landmark-science-report-confirms-big-oils-fingerprints-on-extreme-weather-as-industry-races-for-legal-shield,False
48978306,"Grading Is Easy, Feedback Is Hard: Evaluating LLMs for OOP Assessment [pdf]",2,0,1784552563,lucis,https://github.com/elipcs/grading-is-easy-feedback-is-hard/blob/main/docs/Grading_Is_Easy_Feedback_Is_Hard.pdf,False
48978301,Memory Safety's Hardest Problem,4,1,1784552518,surprisetalk,https://matklad.github.io/2026/07/20/memory-safety-hardest-problem.html,False
48978296,Show HN: Give your AI agent a personality (and a voice) without external APIs,2,0,1784552486,pcbmaker20,https://fellowgeek.github.io/mcp-speak/,False
48978294,AgentBaiting: Fake AI Skills and MCP Servers Delivered Malware,2,0,1784552469,deronEx,https://www.island.io/blog/agentbaiting-how-800-fake-ai-skills-and-mcp-servers-delivered-malware,False
48978293,"Anduril reveals Thunder, a 'loyal wingman' drone for helicopters",2,0,1784552463,atlasunshrugged,https://breakingdefense.com/2026/07/anduril-reveals-thunder-a-loyal-wingman-drone-for-helicopters/,False
48978291,The Most Counterintuitive Way to Build a Brain [video],2,0,1784552462,surprisetalk,https://www.youtube.com/watch?v=cDxtFtoQVNc,False
48978268,MIT researcher proposes a way to detect nuclear weapons in space,4,2,1784552329,JeanKage,https://news.mit.edu/2026/mit-researcher-proposes-way-to-detect-nuclear-weapons-in-space-0708,False
48978257,Yunnan's mineral wealth and border corridors could solve China's Malacca dilemma,2,0,1784552269,teleforce,https://www.scmp.com/news/china/military/article/3361079/how-yunnans-mineral-wealth-and-border-corridors-could-solve-chinas-malacca-dilemma,False
48978177,How Would For-Hire Autonomous Vehicles Impact NYC?,2,0,1784551818,geox,https://www.openplans.org/how-for-hire-autonomous-vehicles-impact-nyc,False
48978170,The Return (2024 Film),2,1,1784551794,BiraIgnacio,https://en.wikipedia.org/wiki/The_Return_(2024_film),False
48978143,CRA Compliance Kit – EU Cyber Resilience Act in One Pip Install,2,0,1784551709,sparka,https://starcaller.uk/cra-compliance/,False
48978098,AgentAbstain: Do LLM Agents Know When Not to Act?,3,0,1784551503,embedding-shape,https://arxiv.org/abs/2607.10059,False
48978075,AGI Singer: Take the Next Exit,3,0,1784551382,miho999lv,https://medium.com/@miho999lv/agi-singer-take-the-next-exit-21355823c289,False
48978064,ESP32 Server: Distributing HTTP/2 Streams over TLS,2,0,1784551331,CaioFer,https://c410-f3r.github.io/thoughts/esp32-server-distributing-http2-streams-over-tls/,False
48978053,How the Apple Watch water lock feature works,2,0,1784551279,bookofjoe,https://www.engadget.com/2213629/how-apple-watch-water-lock-feature-works/,False
48978046,The Tablet the Doctor Ordered,2,0,1784551254,dxs,https://cuencahighlife.com/the-tablet-the-doctor-ordered/,False
48978038,Proof of Fermat Last Theorem from Scratch [video],2,0,1784551242,surprisetalk,https://www.youtube.com/watch?v=9f-hGSh8lF0,False
48978032,Rust 2018: Libraries in the 2018 Epoch,2,0,1784551220,ibobev,https://zayenz.se/blog/post/rust-2018/,False
48978031,"Trump's War on the Future, Monetary Edition",5,0,1784551217,dxs,https://paulkrugman.substack.com/p/trumps-war-on-the-future-monetary,False
48978020,'Synthetic insider' attacks raise stakes for corporate cyber defence,2,0,1784551184,thm,https://www.ft.com/content/67fe2b44-2041-4ee1-b606-5def4d717407,False
48978011,"Cross-Platform Amiga and Atari ST C Programming (""Not Conio but Compatible"")",3,0,1784551149,ibobev,https://retrogamecoders.com/st-amiga-vbcc-c-not-conio/,False
48977996,Making a Simulation Game – Part 2: The Engine Doesn't Know What Beer Is,2,0,1784551040,poga,https://scarlet.engineering/blog/making-simulation-game-part-2-architecture/,False
48977994,The 'anti-Greta Thunberg' weather nerd debunking climate myths,4,2,1784551030,bilsbie,https://nypost.com/2025/05/31/us-news/meet-the-anti-greta-thunberg-weather-nerd-debunking-climate-myths-and-skewering-the-extremist-elder-statesmen/,False
48977963,The Library of Babel,2,0,1784550865,carnufex,https://ryanbieber.github.io/libraryofbabel/,False
48977911,Search Risk vs. Execution Risk,2,1,1784550614,zakihasan,https://www.zakihsn.com/writing/building/search-risk-vs-execution-risk,False
48977896,Pegel – catch silent data breakage in Postgres before it reaches your dashboards,2,1,1784550551,mckeco,https://data-watchtower.com,False
48977870,Sarah's Wager,2,0,1784550421,jger15,https://colossus.com/article/sarah-guo-conviction/,False
48977869,The CIAM Graveyard: Every Dead Identity Vendor and What Killed Them,3,0,1784550415,mooreds,https://securityboulevard.com/2026/07/the-ciam-graveyard-every-dead-identity-vendor-and-what-killed-them/,False
48977850,The Scrolly Chair,2,0,1784550356,rpgbr,https://www.newcartographies.com/p/the-scrolly-chair,False
48977795,New Spinning Drone Hides in Plain Sight,2,0,1784550133,DemiGuru,https://www.mccormick.northwestern.edu/news/articles/2026/07/new-spinning-drone-hides-in-plain-sight/,False
48977782,Dungeons and Dryers,2,0,1784550060,surprisetalk,https://thega.me.uk/2026/07/dungeons-and-dryers/,False
48977781,Text-to-CAD Is Too Small for Building Real Hardware,2,0,1784550057,opuslabs,https://opuslabs.substack.com/p/hardware-needs-its-vibe-coding-moment,False
48977725,LLVM Divination of GFX1251's Differences,2,0,1784549734,simonpure,https://chipsandcheese.com/p/llvm-divination-of-gfx1251s-differences,False
48977687,Food delivery rider wins China's top literary prize,3,0,1784549531,impish9208,https://www.bbc.com/news/articles/c5ydr3xd0kvo,False
48977670,"World shift to clean energy is unstoppable, IEA report says",2,0,1784549443,crowdhailer,https://www.bbc.co.uk/news/science-environment-67198206,False
48977653,Researchers copy NASA climate data to Swiss supercomputer amid US funding cuts,3,1,1784549391,giuliomagnifico,https://www.rfi.fr/en/international-news/20260720-swiss-researchers-hoard-vast-trove-of-nasa-climate-data,False
48977634,AI Is the Best CoFounder,1,1,1784549253,TimLeland,https://timleland.com/ai-is-the-best-co-founder/,False
48977630,"RTK hook makes coding agents more expensive, not cheaper",2,0,1784549250,neuraldenis,https://blog.jetbrains.com/ai/2026/07/rtk-claude-code-token-savings/,False
48977627,The Aspirations of HPE and Dell in the Quantum-Classical HPC Datacenter,2,0,1784549230,rbanffy,https://www.nextplatform.com/compute/2026/07/13/the-aspirations-of-hpe-and-dell-in-the-quantum-classical-hpc-datacenter/5270664,False
48977607,Canada's boreal wildfires aren't bad forest management,5,0,1784549113,throw0101d,https://www.theclimatebrink.com/p/canadas-boreal-wildfires-arent-just,False
48977600,Turning the NES into a thermometer using the PPU's $2002 open-bus decay,2,0,1784549058,erspicu,,False
48977582,Automating first-pass customer support with Claude Code and MCP,2,0,1784548966,kizum,https://sitespeak.ai/blog/automate-customer-support-mcp,False
48977579,Show HN: After a break up I made an app to fix how I feel,3,0,1784548947,momoelz,https://apps.apple.com/redeem/?ctx=offercodes&id=6445867241&code=MEMOIRI2,False
48977564,The Trump administration's Threat to Scientific Research,69,20,1784548843,surprisetalk,https://marginalrevolution.com/marginalrevolution/2026/07/the-trump-administrations-threat-to-scientific-research.html,False
48977554,Don't Just Nationalize AI. Democratize It,1,0,1784548759,one33seven,https://jacobin.com/2026/07/ai-democratization-working-class-institutions,False
48977525,Why Your Daily Standup Notes Are Useless,2,2,1784548600,kestermckinney,https://www.projectnotespro.com/news/why-your-daily-standup-notes-are-useless,False
48977507,Deriving the Obvious,2,0,1784548465,petschge,https://diagrammonkey.wordpress.com/2026/07/19/deriving-the-obvious/,False
48977497,Values-First Living,1,0,1784548396,waaldev,https://jmbhughes.waldi.blog/values-first-living,False
48977495,Introduction to If (Bash),3,2,1784548375,vladde,https://tldp.org/LDP/Bash-Beginners-Guide/html/sect_07_01.html,False
48977463,Why malloc always does more than I asked for?,3,2,1784548201,nathaah3,https://ssenthilnathan3.github.io/blog/malloc/,False
48977460,Show HN: Restk – a native API client that stores your workspace as files in Git,1,0,1784548185,jhaliya,https://restk.ai,False
48977458,Mirror Mirror: Self-hosted screen mirroring to your phone,1,1,1784548165,maco3000,https://github.com/maco30001/Mirror-Mirror,False
48977453,The secret Trump administration battle to fight Chinese AI,11,2,1784548128,nnx,https://www.axios.com/2026/07/20/ai-us-china-open-source-kimi,False
48977423,Show HN: An end to end SEO audit,1,1,1784547961,richardbaxter,https://github.com/houtini-ai/seo-audit-console,False
48977409,Discovery and characterization of antitumor gut microbiota from amphibians,2,0,1784547865,he0001,https://www.tandfonline.com/doi/full/10.1080/19490976.2025.2599562,False
48977355,Through Thick and Thermocline,1,0,1784547397,jequals5,https://www.bassfinity.com/blog/through-the-thick-of-it-punching-summer-grass-mats,False
48977329,DWCS: Why I Open-Sourced My Game Infrastructure Early,2,0,1784547172,Ahadprogamer,https://medium.com/@www.ahadprogamer/i-built-an-open-source-multiplayer-backend-for-a-vr-game-that-doesnt-exist-yet-1c71661c7ed8,False
48977327,Extinction Rebellion pelt Microsoft Dutch data center site with acid balloons,2,0,1784547154,giuliomagnifico,https://www.datacenterdynamics.com/en/news/extinction-rebellion-pelts-microsoft-data-center-site-with-acid-filled-balloons/,False
48977325,"Marvell Brings Radix, Low Latency, and Bandwidth to Bear with Teralynx T100",2,0,1784547134,rbanffy,https://www.nextplatform.com/connect/2026/07/17/marvell-brings-radix-low-latency-and-bandwidth-to-bear-with-teralynx-t100/5274615,False
48977309,Wharton and Harvard Business School: LLMs on business decisions and tasks,2,0,1784547039,patelajay285,https://business-ai-benchmark.github.io/,False
48977293,"Show HN: RefundHalt, contest App Store and Google Play refunds automatically",1,3,1784546942,kedv,https://refundhalt.com,False
48977278,Major AI models are likely to refuse criticizing restrictive leaders or govts,3,1,1784546775,smurda,https://apnews.com/article/artificial-intelligence-chatbots-censorship-bias-free-speech-fed8fdbf90751c10fe77b77832e0ffba,False
48977270,Why is it so hard for the U.S. to win wars?,36,121,1784546685,rbanffy,https://www.npr.org/2026/07/18/g-s1-134037/why-is-it-so-hard-for-the-u-s-to-win-wars,False
48977247,India's first privately-developed rocket reaches orbit on dramatic debut launch,2,0,1784546502,rbanffy,https://arstechnica.com/space/2026/07/indias-first-privately-developed-rocket-reaches-orbit-on-dramatic-debut-launch/,False
48977229,Show HN: I built a pinball repair tool grounded in the real service manuals,1,0,1784546399,mcpit,https://joinflipside.com.au/repair/,False
48977228,Understanding Go AI Inference: What Is Inference?,2,0,1784546393,valyala,https://internals-for-interns.com/posts/go-ai-inference-what-is-inference/,False
48977201,Commission fines AliExpress €550M for breaching the Digital Services Act,5,1,1784546097,robin_reala,https://digital-strategy.ec.europa.eu/en/news/commission-fines-aliexpress-eu550-million-breaching-digital-services-act,False
48977193,"Show HN: Diagraw-draw AWS/GCP/IBM archs with icons, arrows that stay attached",1,0,1784546047,victoragudo,https://diagraw.com/,False
48977185,Alibaba Fined Record €550M by EU for Illegal Sales,5,3,1784545999,technewssss,https://www.bloomberg.com/news/articles/2026-07-20/alibaba-fined-550-million-for-illegal-sales-in-biggest-dsa-case,False
48977182,Ask HN: What would a Python-first web look like?,1,1,1784545976,RS-232,,True
48977181,DeepWaiting mindfulness while you wait,1,0,1784545967,Zeekaas,https://deepwaiting.xyz,False
48977134,Coercion and Deception in AI-to-AI Management: An Agentic Benchmark,1,0,1784545626,sbulaev,https://arxiv.org/abs/2607.15434,False
48977130,Lāhainā Noon in HawaiʻI: When and Where to See IT,2,0,1784545605,_tk_,https://www.lovebigisland.com/hawaii-blog/lahaina-noon-when-and-where/,False
48977126,Show HN: Picnic Host – No fuss static website hosting,1,0,1784545539,jeremysarchet,https://picnic.host/en/index.html,False
48977071,EU slaps €550M fine on AliExpress over illegal and counterfeit goods,3,1,1784545213,muxamilian,https://www.euronews.com/my-europe/2026/07/20/eu-slaps-550-million-fine-on-aliexpress-over-illegal-and-counterfeit-goods,False
48977032,"Show HN: Hail.so – Open-source phone, SMS and email for agents and humans, v0.15",1,1,1784544950,r13i,https://github.com/hail-hq/hail/,False
48977020,Show HN: Test harness that found +250 bugs in open-source matching engines,1,0,1784544859,roycechocolate,https://github.com/flash1-dev/matching-engine-benchmark,False
48977014,Reporting Web 3D Capabilities on a Budget of $3 a Month,1,0,1784544839,bhouston,https://ben3d.ca/blog/reporting-web-3d-capabilities-on-a-budget,False
48976998,About AgentRQ – Human-in-loop realtime conversational task manager for AI Agents,2,0,1784544658,shahargl,https://github.com/agentrq/agentrq,False
48976997,Minimal Git CI using hooks,3,0,1784544650,olexsmir,https://mccd.space/posts/26-06-29/simple-git-ci,False
48976989,"Show HN: A comprehensive, filterable list of AI agent jails",8,3,1784544572,petesergeant,https://pleasedonotescape.com/,False
48976984,Human mathematicians are being outcounterexampled,3,0,1784544497,vitplister,https://xenaproject.wordpress.com/2026/07/20/human-mathematicians-are-being-outcounterexampled/,False
48976964,Nightborne – A Neill Blomkamp Sci-Fi Film. AI (4K) [video],2,0,1784544325,mxfh,https://www.youtube.com/watch?v=8Wbtt2JxP7g,False
48976949,Screenshot Editor Tool (SuperSnap) – 5 Free Lifetime Keys,1,0,1784544204,daniel_at08,https://supersnap.net,False
48976940,"China's Moonshot pauses Kimi subscriptions amid hot demand, IPO push",3,1,1784544092,JumpCrisscross,https://www.reuters.com/legal/transactional/chinas-moonshot-pauses-kimi-subscriptions-amid-hot-demand-ipo-push-2026-07-20/,False
48976938,Connect Your AI Agent to Any API in Plain English (No Code),2,0,1784544079,piotrgrudzien,https://quickchat.ai/post/connect-ai-agent-to-any-api,False
48976911,"What Happened to Le Chat? Mistral's Vibe Rebrand, Tested (2026)",1,1,1784543836,technewssss,https://mrkt30.com/what-happened-to-le-chat-mistrals-vibe-rebrand-tested-2026/,False
48976900,From Proton to Posteo: Embracing the Underdog,1,0,1784543785,g-b-r,https://moonwriting.blog/from-proton-to-posteo-embracing-the-underdog,False
48976896,The Travelers,1,0,1784543768,alihadi965,https://www.seatlr.com/,False
48976894,Tree-of-Life and Evolution of Code,1,0,1784543754,gritzko,http://replicated.live/blog/worktree,False
48976874,Environmental Performance Index (EPI) 2026,2,1,1784543656,omkar-foss,https://epi.yale.edu/indicator/2026/EPI,False
48976859,Show HN: Trust Vault – encrypted file vaults with flexible key management,1,0,1784543520,midaef,https://github.com/namelesscorp/tvault,False
48976858,The 'Bad Blood' Between Polymarket's Shayne Coplan and Kalshi's Tarek Mansour,1,0,1784543518,thm,https://www.nytimes.com/2026/07/19/technology/polymarket-kalshi-rivalry-coplan-mansour.html,False
48976848,Spinning drone hides in plain sight,2,1,1784543449,_kb,https://news.northwestern.edu/stories/2026/07/new-spinning-drone-hides-in-plain-sight,False
